,name,overall_rating,review_text,date,review_count
298,Hello Goodbye,3.7,"My first experience at this place last weekend for my birthday was amazing. The drinks were yummy, cool crowds, very friendly chatty bathroom attendant :) he was awesome. Great music. My friends and i had a fab time. The only reason im giving it a 4 star is due to the managers attitude. He was very rude. Was yelling at people. And just in a very bad mood for a fun place like this bar. As long as u dont run into the manager u ll have an amazing time here :)",2018-06-07T21:16:20Z,34
299,Hello Goodbye,3.7,"This place had a nice, cozy ambiance and the drink menu was creative and extensive. (great variety between refreshing, and liquor forward cocktails) We had a seat at the bar in the corner, and the bartender was attentive and service was good. 
Overall a fun experience and worth checking out.",2016-08-10T17:01:29Z,34
300,Hello Goodbye,3.7,"We were dealing with MICKY VALENS and hes a rookie promoter. I will NEVER go to Hello Goodbye again because of the way we were treated and since he cant prortize his reservations. I reserved a vip booth for 3 bottles for my sisters birthday. When we got there it took us forever to get in the club cause they were ""overwhelmed"" with the amount of people who showed up at the same time for bottle service. When we FINALLY got inside MICKY gave us a table that seats 4-5 people.. there were 10 of us lol. He said that people stand around anyways but hows that his decision to make? I then stated we should all fit COMFORTABLY and he obviously had nothing to say. I told him we had a reservation for the VIP BOOTH and he said he couldnt accommodate us due to ALL the booths being sold out since we showed up later. In our emails he told me to come ""12:30 latest"" it was 11:30 when we showed up. Anyone would think they have untill 12:30 to show up and after that our booth would be given away which is fair. When i confronted him, he was super rude and not willing to accommodate us. When i asked him why he couldnt have let me know the vip booth that i RESERVED was sold out he looked at me threw his hands up and said no i couldnt and shruged his shoulders. How does that make sense? When i said were not going to stay he said okay , threw his hand in my face and said you can leave and walked away. We obviously left and spent our money else where. We went to cabana for bottle service and had alot of fun and they even threw in bottles of champagne/shots after we told them what happened at this wack bar. So i owe it to MICKY for messing up since we had a way better time at cabana. Take my advice and never ever deal with this guy, he has no idea what hes doing. And if you do, be there before the club opens because you wont be guaranteed your reservation.",2019-09-30T23:37:06Z,34
301,Hello Goodbye,3.7,"Was on a day trip to Vancouver for work and wanted to get some drinks and do some people watching.  Drove around for about 30min looking and could not find anything so that's when I decided to get some assistance online.  Found the door and the hostess walked us down.

Once inside I was surprised at the room, the place was small but very cool, comfortable seats, good lighting and really cool music.  The staff was very nice and cocktails were delicious!",2016-08-04T19:37:44Z,34
302,Hello Goodbye,3.7,"Visiting Vancouver during my 20s and now 30s, I finally got a chance to find a cool bar for people my age. When we showed up to the hidden door (that was propped open) through the brick wall, there was a small lineup outside.  We were greeted by a man who was friendly and well dressed.  There was a 10-15min wait as he said they were having capacity issues.

My friends and I each ordered something different off the cocktail menu.  The server was very knowledgeable about the cocktails and tried to cater to what we liked.  There was a DJ and the music was good, a lot of 90's R&B, indie and hip hop.  The crowd was cool but then it got really busy after midnight.  I recommend going earlier.

A great little speakeasy/lounge to go with a small group to have good drinks and great conversation!",2016-08-02T20:20:08Z,34
303,Hello Goodbye,3.7,"Nice place to get the underground bar experience in yaletown. It is pretty small and gets packed. The music is hip hop/rap. They could do better with the music for sure! I loved their spinach pattys, soo tasty!",2016-02-12T20:20:54Z,34
304,Hello Goodbye,3.7,"Bouncer said they were over capacity but if we reserve a table at that moment ($100/person) they can let us in. Otherwise, bouncer will tell you to come back between 15mins-1hr on a Friday night (~930pm). When we came back after 15 mins, they said only 4 out of 7 in our group can come in because of overcapacity, so when 3 of my friends decided to just leave, they let 4 of us in and at the same time, 4 other people who just lined up were able to enter. Not sure why they were overcapacity for 7 people but not 8 people? Once inside, it was not busy. No cover, but mandatory $5 coat check.",2017-04-22T14:25:19Z,34
305,Hello Goodbye,3.7,"Place is dope!! So buys on the weekends and such a unique atmosphere for YT, loved it!! Most attractive room I have been to in a minute.",2016-02-17T00:44:55Z,34
306,Hello Goodbye,3.7,"The absolute worst most rude obnoxious bar experience of my life. Buddy bought 4 drinks for some friends, brought them over, and one was sparking water with a little bit of ginger ale. So went to the bartender and explained and he denied me claiming that my full glass of liquid was some Random drink. Asian dude, buzzed head, muscular. I asked to speak to the manager and he refused.",2016-06-26T09:09:33Z,34
307,Crush Champagne Lounge,4.0,"I like this place. When you want to go for a non-crazy night out this place is great. Very chill vibe, but still with a dress code kinda thing. I always like the crowd, drinks are always great. It's a good place if you're looking for a more intimate atmosphere.",2009-02-02T18:47:14Z,1
308,M.i.a,1.8,"Loud and empty. zero stars. This might be the worst club ever. I'm shocked that they could get anyone to pay a cover.

Don't go",2018-03-10T09:56:58Z,12
309,M.i.a,1.8,"Horrible experience!!
They pulled a UNITED when they were at fault
1 star is too much from the experience and their staff caused unnecessary injury",2018-03-30T10:32:18Z,12
310,M.i.a,1.8,"Mia hosted Tea Party tonight. No fault of the organisers but the event was very popular, and the security were absolutely terrible. All they needed to do was control the crowd and tell them it was full. But instead, they were lazy and did nothing to stop the problem. One man, tanned and tall, was particularly bad. He did nothing to stop the problem, just kept pretending it wasn't his fault. He was rude and forceful with the customers. He needs to be fired In my opinion as he obviously has no experience. 
Tea Party is obviously a popular night- the security really made all.the mistakes tonight.",2018-06-21T06:58:26Z,12
311,M.i.a,1.8,"Came down to MIA from Seattle for the first time to see TOKiMONSTA. The bouncer was friendly and chill. There was an adorable Asian girl bartending with a lot of personality and it was fun to watch her. The lounge room was nice and cool- almost felt like AC was blowing around on the wall. The bathrooms were clean. The DJ booth had padding up front so it's very comfortable to hold on to and the lights streaming across the ceiling and down the walls looked awesome. It got pretty packed inside but nobody was pushing into me or knocking me around, was still bumping at 2am. Would give 5 stars if they had just a little more space :)

The Funkiton Ones sounded clear and the bass was clean. I don't know what it was like before, but it met all my needs, had a great time!",2016-05-01T19:58:49Z,12
312,M.i.a,1.8,"The door staff is excessively sensitive. 
I stepped over the low slung exit rope to catch up to my friend who was leaving.
When I returned they refused me entry.",2015-06-01T01:01:36Z,12
313,M.i.a,1.8,"In review.  Turn out Odezsa was doing a double feature and did come to this venue.  Sold my ticket to another interested person.    Updating my review because it was simply false.

Will visit another time.",2015-12-16T08:58:31Z,12
314,M.i.a,1.8,"I'll write an update review when this club is a bit more established but wanted to share some quick thoughts now. I never went to Shine before they closed their doors but M.I.A.'s entrance is on Water St and not right at the corner like Shine's used to be. We went on a Friday and knew that it would be dead but wanted to check it out anyway. Well, cover was $15 and we went in around 11:30pm. Maybe 5 people were there and the dance floor was empty. We left and came back at 1:30, still dead.

The 1* is just to indicate that it's not really a happening place right now probably because it just opened a month ago. Hopefully they get a good crowd going soon. The concept is interesting - they stress ""no cameras and no phones."" I'm hoping I can write an update review later on.",2015-04-20T18:27:23Z,12
315,M.i.a,1.8,"Bad sound quality, space and bouncers pushing you around makes it even harder to enjoy (may be they were @Guy J's fans). Lost my glasses because of the aforementioned reason near the emergency exit. Just because I had a drink in my hand and was on the floor looking for my glasses, the primitive-brained bouncer chose to think that I was sneaking out my drink. He then proceeded to threaten my life and family. Terrible and abusive staff. Will not be going back.",2015-09-06T21:08:47Z,12
316,M.i.a,1.8,"Take your business elsewhere.
Here are a couple of price breakdowns:
Cover on a Saturday night was $25
Coat-check was mandatory and cost $4
Service charge on their ATM was $4
A bottle of ""cheap beer"" was $7

Immediately after entering this glorified rat maze, I was hit by a thick wall of humidity and body odour. The club was tiny, unventilated and there were so many people packed in that it was virtually impossible to dance, or even move from one end to the other.
The bar service was atrocious and the drinks were overpriced.
I walked through a flooded corridor to get to the exceptionally filthy washrooms.
This place takes the cake for the worst club I've been to in Vancouver.
If you're absolutely dead-set on visiting a scuzzy club, you're better off with The Roxy. At least they provide some decent service and they don't try to pass themselves off as something they are not.

I won't be returning here, and I will do everything in my power to education others in the hope that they won't make the same mistake I did. I will also be filing a formal report to City Hall concerning their blatant disregard for the establishment occupancy limits.

Think one disgruntled customer can't affect the reputation of an establishment? 
Just watch me.",2016-09-11T12:11:40Z,12
317,M.i.a,1.8,Great place for techno and deep house.  Bouncers were nice to me when I tried to take my drink outside the club instead of being too strict. Bar staff were great. Please try bring in Bicep or Ejeca that would be cool.,2018-05-22T00:44:41Z,12
318,M.i.a,1.8,"I've been to a lot of shows at a lot of crappy venues, but this one takes the cake. Crammed so full of people at the Jai Wolf show that it was impossible to move without hitting someone, no ventilation, bad sound, overpriced drinks, excessive airport-like security,  rude, pushy bouncers and who the fuck puts an ATM machine right in front of the front door? The kind of club that makes you wants to stay home for the rest of your life. Srsly -- you've been warned.",2016-05-09T22:24:31Z,12
319,M.i.a,1.8,"MIA, Shines No More.  
Was excited to check out the legendary Kevin Saunderson at new club MIA.  While he was amazing, my heart sank at the butchery of one of my favourite clubs. I loved Shine: the corner entry; two rooms (one more chill); two bars; loungy area; disco ball; speaker wall; and nice cool breeze.  
It's all gone now... 
Enter MIA - at your own risk that is:
side entrance with old incorrectly spaced stairs; long slim entry that's cramped with turns and too much like a house of mirrors (I wondered if they had a camera set up to laugh at wasted people walking into the glass.  Then later witnessed someone do just that); the bar on the wrong side of the room (who wants to maneuver a crowd to get a beverage?); the cave looked cool but would have been cooler if it was behind the dj booth; cramped vip spaces; the lighting effect on the ceiling is interesting, yet when you look at it you get blinded by LED spots,
no airflow which isn't surprising with the lack of flow through out the space; sound system was sweet but I couldn't wait to leave.
I'm MIA from this club for good.",2015-07-15T05:28:08Z,12
320,The Fox Cabaret,3.2,"Bathrooms are unsafe.(Men can wander into womens , and vice versa) no place of solitude. Drinks are unnecessarily expensive.",2023-10-19T07:02:34Z,46
321,The Fox Cabaret,3.2,Love this place.  A rare find.  One of the few places to see a live show in a venue that is just small enough to see the band in a more intimate setting.  Friendly staff and door guys too.,2023-08-31T15:19:57Z,46
322,The Fox Cabaret,3.2,"had such a good time... UNTIL I went outside to cool off

so my friend and I got here around 1030 and spent a couple hours dancing and drinking. I think I spent around $90 on drinks. After being on stage and dancing and getting very sweaty for about 8 songs we went outside to cool off. This was when my problems started.

My stamp, unfortunately, rubbed off. I was VERY sweaty. Dancing does that to you, weirdly.. I also washed my hands twice since I arrived. sometimes when you drink you have to pee. WILD.

Anyways...When I tried to go back inside, they told me I wasn't allowed in and I would have to wait in the line and pay cover again. He told me that the stamps didn't wash off, ever (somehow). Like this was some sort of actual tattoo and not just... A stamp. I explained that I just came outside to cool off. Didn't help. I showed them credit card charges totaling $90 from the night. Didn't help. He asked the woman who let me in. she confirmed she recognized me. ALSO DIDNT HELP. I felt like I was in the twilight zone. The most insane part was I walked by BOTH said bouncers to go outside. I wasn't being sneaky. I wasn't hiding anything. Just trying to cool off and then hopefully spend $50-$100 more there before calling it a night. I was ready to let loose!

anyways, the bouncers made sure to berate and belittle me in front of a crowd of people and it was really embarrassing!! After spending over a hundred bucks there it was the biggest slap in the face. I have never been treated like that in my life. I came with the best intentions and was treated like a crook. just crazy.

I hope the two guys at the door enjoy their power trip. I will be contacting mgmt in addition to this review because this entire experience was absolutely absurd.

Loved the bar, loved the DJ, loved the night up to this. Wish I was leaving with a better memory of my evening.",2023-07-30T08:27:40Z,46
323,The Fox Cabaret,3.2,Great place. Attended a private event and it was all positive. Great staff and a clean faculty,2022-08-25T01:51:02Z,46
324,The Fox Cabaret,3.2,"Rip off. Charges 2 covers for 1 night.
Horrible customer service. When I paid cover they never mentioned that we would have to pay again to get in for the show later on. Door girl is rude and has no compassion. Don't go here",2022-06-19T06:46:13Z,46
325,The Fox Cabaret,3.2,"It's been a while since I have ripped it up in a night club and the Fox Cabaret was a very entertaining surprise. The Fox is located in Mount Pleasant on Main St. near 7th ave, in an old movie theater. The projection room has been transformed into the dance floor! 

It's a long and narrow building with two levels. Upstairs you will find a balcony with a great view of all the party goers below, a second bar and some cosy spots to get your chill on. Next door is another smaller room called the Cabaret room, and of course the main room downstairs, The Projection room. The Projection room has tables and bench seating which is great, because I often want to sit, drink and people watch, as well as a large bar, and small dance floor.

Overall it is a more intimate venue and rather unique! I love that they maintained some of the Cinema decor and made it work as a bar/club. They have weekly events with live bands and performers, such as Wednesday night stand up comedy and Sunday night improve. Of course Thursday, Friday and Saturday's are your nights to shake your booty with different DJs or live bands. 

We visited for a friends birthday, and although I may have already had my fair share of drinks, I was quite pleased with a few factors with this venue. The first, we did not have to wait in line! It was a Saturday night at about 12:30. Super huge plus because I have little patience for line ups. Next, the cover was $12, which is probably pretty standard these days, but my opinion is there should be a live band or DJ to warrant that fee. The DJ was fantastic!!! Worth every penny. I had one drink and had to hit the floor! I don't know who he/she was but it was epic!! ‍

They have drink specials   which are prepared by easygoing bartenders, but.....I am taking a star away for the fact that they only accept cash.  There is a bank machine which charges you $3, plus your bank will charge on top of that. It's 2018, time to up your game with portable debit machines!! Honestly, they would only make more money and inconvenience patrons less. Also, the ladies bathroom was a bit on the small side.",2018-04-12T01:08:59Z,46
326,The Fox Cabaret,3.2,"Was deeply harassed by staff coming early to do work for a show, had to forfeited the gig as a result. Clearly predators on the arts community. Never did see a show there.",2023-02-20T01:47:21Z,46
327,The Fox Cabaret,3.2,"Lived in Vancouver all my life that this is the first time, I attended an event at Fox Cabaret. I was here for the Nerd Nite. From the outside, it looked super run down like a night club. Well maybe it can or is a night club at one point. Not sure about that. The venue wasn't bad. There is a stage in the venue, a bar area and bar high top tables at the back. 

Inside is a bit run down and can be sticky due to the sticky beer spill. Yes the place does have a strong beer smell. The chairs up front are temporary chairs not theater style. 

Guess venue can be use for multi-purpose.",2018-05-07T06:04:15Z,46
328,The Fox Cabaret,3.2,"This place attracts a certain type of East-Van person. East Van people may seem like young, open minded people, but really this place intimidates me with its homogeneity. 

Lack of diversity, and I hardly feel included inside this place. Its not for me, doesn't mean you won't love it. I don't think they designed it to make me not want to come, but the couple of times I've been here, I've not liked it. 

It does however have shows lined up for almost every day of the week. So, absolutely do go and check it out! It could be your cup of tea.",2018-06-11T23:58:18Z,46
329,The Fox Cabaret,3.2,"Spontaneously decided to hit up The Fox last night! After enjoying a Christmas dinner we just googled events that were happening and it was #Bossy night, which meant femme powered hip hop and r&b. YEAAAH sign me up !!! 

It's honestly so hard to find good decent hip hop events in Vancouver. I was pleasantly surprised because we didn't have to wait long in line at all and there were hardly any line ups at the bar. We were able to grab a table and sit down to chill in between dancing. It was such a better and refreshing vibe compared to some of the ratchet clubs downtown. I like how the crowd was a diverse mix of people and you could literally walk in wearing whatever you feel comfortable in -- there were a lot of people wearing Christmas sweaters which I thought was rather cute ! 

Music was a lot better in the beginning of the night . the djs switched half way thru and then it got really weird around 1245 so we left. The 2nd DJ completely strayed from the hip hop theme--didn't bother to read the crowd and just seem to play whatever he wanted. If the first DJ stayed on for longer, we would have too ! 

PS the $5 shooters were pretty tasty. If you bring cash there's a convenient little bar on the side where you can get them. We got 2 rounds of the ""crouching tiger"" which had a nice refreshing lychee flavour !",2017-12-17T20:34:39Z,46
330,The Fox Cabaret,3.2,"This is a good location for a little night club. There aren't any others really around that area. There was a line to wait in which caused some people to leave and cover charge. The people in the club were all very young. I would say 19-30ish but mostly early 20's, when I went.The club in small but looks cool. 
My drink was over priced and unusually small. There was no where to sit. The music was fun but a bit predictable. Those who where there seemed to be having a good time dancing. Mostly people in their early 20's. So if you only want to dance it's a good place for that.",2018-06-01T19:59:42Z,46
331,The Fox Cabaret,3.2,"This might not be the classiest or best laid-out venue in the city, but it totally works for what they do. Just inside the entrance there are tables with bench seating and stools. Along the right side is the bar, with another smaller bar occasionally open on the balcony - oh, and they have a balcony. Also upstairs are the bathrooms, which have always been fairly clean.

The staff have always been friendly and chill. There's usually a drink special, often on group-oriented stuff like pitchers or buckets of particular bottles. They also usually have self-serve water jugs out so you don't have to feel like a jerk for asking the bartender for water.

Its location is also super convenient: it's literally a 1 minute walk from 5 bus lines, including an B-Line (express) and 3 Night Buses. Around it are several decent food options (several vegetarian friendly), and a few locations good for pre-gaming or post-event hangin' out. (There is even a second smaller bar/club inside the building upstairs, if you enjoy hipster stuff.)

I've only been here for comedy shows (like their regular improv show, ""Sunday Service"") and concerts, but it works well for both.",2017-07-12T00:54:09Z,46
332,The Fox Cabaret,3.2,"Came here on a Saturday night and was thoroughly disappointed . The same beats and music were repeated over and over again . When I went to the DJ to request a song, his response was overly rude and unnecessary . Seems like the kinda guy who wants to take advantage of the small amount of power he has. 
The venue does have a pretty cool set up. Too bad the DJ has no talent and was an absolute dick.
Probably won't go back !",2019-03-13T16:29:49Z,46
333,The Fox Cabaret,3.2,"I am a huge fan of more venues of this kind popping up.  Vancouver needs more places to DO things and I am always keen to see a place bring foot traffic to an area at night (even better if it is a stretch where it doesn't disturb apartments or houses).  I cannot think of a place more suited for a venue, 

Everyone seems to know the history of this place,.. it was an Indian porn theatre for decades and seems a miracle to me that it wasn't torn down.  And it is a good thing, the bones of it are perfect for a sustainable sized venue not on the disgusting Granville downtown douche-bag row.

I think the reno was ok, though it is a bit dark in there, but I love that they kept the sign form the outside and used it as a feature inside. One minor complaint is that the venue is a long, narrow chute,.. and table layout might have been better, but that is getting picky.  There is also this crazy louge upstairs! Vancouver's best kept secret!  I highly recommend taking a look at that and the balcony, both allowing for special events and making this a true ""multi-purpose"" venue.

Not to end on a low note, but my biggest beef about this place is the same as what it would have been for the Waldorf: programming.  We went for Nerd Nite, maybe not the best venue for that kind of quiet event, but the usual programming historically has not been for me, I hate DJs. and prefer real musicians.  I like to be able to socialize when I go out to socialize meaning being able to hear (I guess I'm older than the demographic they are aiming for).  They do however have a regular improv group on Sunday Night that is touted as one of Vancouver's best featuring comedian Ryan Biel,.. I'm coming back for that! (I think they are called the Sunday Service)",2015-04-18T14:34:51Z,46
334,The Fox Cabaret,3.2,"I like this place for music shows. It's narrow and intimate with a few remnants of its past life used as decor.

Tonight I saw Jenn Grant here. Wonderful show!! Got to stand up close and hear top Canadian talent live. The smaller size of the venue makes for great acoustic sets.

The drinks are also quite reasonably priced. I hope to see a few more shows here!",2016-02-20T09:40:12Z,46
335,The Fox Cabaret,3.2,"Canceling a comedian because their jokes are too offensive is the funniest thing I've ever heard coming from a venue putting on a ""comedy"" show. You're the people Dave Chappelle warned us about.",2020-01-31T09:20:22Z,46
