,name,overall_rating,review_text,date,review_count
816,D/6 Bar & Lounge,3.6,Last night I went to D6 with some friends. What a great vibe! The DJ was amazing! I am glad they made room for a mini dance floor. The bouncers are always amazing! The bartenders do there best as it is always crazy busy! Amazing expresso martini ! Patrons are pushy and some are too drunk! Love this place as it always gives good people watching!,2019-11-24T15:25:59Z,48
817,D/6 Bar & Lounge,3.6,It's a little pricey but does have live music and a pool table. Interesting cocktails.,2017-10-28T06:36:40Z,48
818,D/6 Bar & Lounge,3.6,"I loved the ambience here. I came here with my colleagues for a holiday gathering. The service was excellent- the waitress was very attentive. We ordered some wine and cocktail and they tasted amazing.

We just had drinks and some appetizers. But I find the seating was not the most comfortable. I wish they had more proper sit-down dining tables instead of casual seats. 

One curious observation: I saw some company was hosting an event for around 100 people at the back (heard it from the waitress). I was surprised to see that because the space at the back wasn't that big, and fitting 100 people seemed strange to me.",2019-05-11T06:24:42Z,48
819,D/6 Bar & Lounge,3.6,A friend of mine was staying at the hotel as they came all the way down from Victoria for a show and we decided to have a few drinks before walking to the stadium. I don't drink so had some virgin drinks that the bartender had his imagination with but my buddy had some drinks before the show. We just wanted somewhere to catch up and catch up before getting surrounded by noise of the concert. The ambiance is really nice and the staff is super friendly.,2018-06-01T22:49:40Z,48
820,D/6 Bar & Lounge,3.6,"Very disappointing first visit. My girlfriend and I were staying at the Parq Hotel and it was early Fri evening and we asked the concierge for a recommendation of a cocktail bar nearby. He recommended D/6 and so we took the elevator up to the 6th Floor.
You enter through the Douglas Hotel which has a beautiful lobby area. We were enthusiastically greeted by a couple of lovely ladies who showed us to the patio area and we were given our choice of table.
The D/6 indoor/outdoor patio is quite spectacular and so we settled down for a few drinks to enjoy the warm weather.
The patio was not busy, maybe 6 tables occupied? We sat for a while, with no menus and no water and were quite effectively ignored by several servers (one of whom actually had to maneuver around our table 3 times to get to her customers). After 10-12 mins we just decided to flag down a server and we quickly ordered a couple of cocktails to get things rolling.
The drinks came but we immediately noticed an ice cube at the top of my girlfriend's cocktail contained some black debris inside and so we looked around for our server for assistance. More minutes passed and so I just took the drink over to the Bar. After drawing the attention of one of the 3 bartenders on service, I pointed out the offending ice cube and watched while he went through an overly dramatic scrutiny of the drink, he then offered to make another one and have it sent over.
After a new drink was served up we finished our cocktails but felt somewhat deflated with the experience and so settled our bill and left.
Overall, we were disappointed. The initial greeting was perfect but that's as good as it got. We were prepared to sit and relax and spend some money but the inattentive service and uninviting vibe made us go elsewhere - perhaps we're not the target audience...",2018-06-07T00:37:31Z,48
821,D/6 Bar & Lounge,3.6,"I have been to this establishment a few times with my friends.  I am so tired of dealing with snobby service staff and the ridiculous prices for drinks.   Tables always have a ""reserved"" sign placed even when they have no reservations.  Nobody is allowed to sit at the tables even if they have been vacant for the entire night.  On one occasion one of my friends mentioned that one of your staff (bathroom attendant) was dealing drugs in the men's restroom.",2019-03-20T02:20:20Z,48
822,D/6 Bar & Lounge,3.6,"In town for a quick trip and my girlfriends planned a night out that included dinner at Victor followed by some drinks at D/6. The food at Victor was fantastic and then we just walked across to D6, so convenient. We were greeted by the GM Marlon English who took us into the beautiful in door/ outdoor lounge and accommodated us in our own private couch area. He also checked in on us later in the night to make sure we were happy with everything. The servers were great, the drinks were perfectly strong and the music was exactly what all of us 8 ladies on a night out would want. D/6 is definitely a place to check out in Vancouver.",2018-10-07T00:56:59Z,48
823,D/6 Bar & Lounge,3.6,D6 is fairly new but I've been here quite a few times on the weekend. I love the atmosphere and decor. It's a very relaxing lounge and a very nice change from the club scene. It's gotten a lot busier since they've opened so it's probably wiser to go before midnight to avoid line ups. They're also open on weekdays and it's a lot quieter but a good place to grab drinks and have a chill night.,2018-04-30T07:21:20Z,48
824,D/6 Bar & Lounge,3.6,"Beautiful place, cool vibe! Great service, okay food. Needs a better selection of wine by the glass for us California gals. The design is amazing, seating outside and music to enjoy. Definitely made an impression on us, would check it out if you are in the area! You won't be disappointed!!",2018-08-11T17:52:43Z,48
825,D/6 Bar & Lounge,3.6,"I came here for a work function and was at the hotel for just under a week.

The venue is modern and stylish. The staff was upscale and professional. 

One bartender however certainly stands out from the rest ... Daniel.

Daniel has a personality that is friendly and inviting and his memory is fantastic.

I visited the lounge a few times during my stay to have a drink on down time or check out the nightlife and as the patrons walked up he would know their order just the way they liked it. 

He really adds life to the place and makes it shine.

My stay in Vancouver was a memorable one because of great people like Daniel!

Amazing job, I would certainly recommend this place!",2018-11-29T03:30:16Z,48
826,D/6 Bar & Lounge,3.6,"A solid new spot for drinks. Makes Vancouver feel a bit more cosmopolitan. But, the music doesn't match its contemporary opulence. And, the casino component brings in a cast of curious characters. Suggest they add metal detectors to their repertoire.",2017-12-10T18:57:16Z,48
827,D/6 Bar & Lounge,3.6,Came here last week with some buddies for a few drinks. First time being there and we all had a great time. Environment was awesome and our server Devyn was hilarious and I'd come back just because of her. Definitely recommend,2018-11-09T05:24:43Z,48
828,D/6 Bar & Lounge,3.6,"I went to D6 for the first time, I was excited since I had a friend tell me it was a good spot to check out but I was sadly mistaken. I went there and upon arrival the staff was very rude!... The staff continuously said the bar was full once me and my friends got there at 1030pm but kept letting people in continuously except us and our party had a table. There was a black girl working the front with almost bald hair/a very short cut who was arrogant and rude with zero hospitality skills and a guy named Marlon that kept telling her not to let us in becuase apparently they were full but Marlon let two girls that came in and expressed that they weren't on guestlist (even though our party had a table) and he still let them in before us. I felt discriminated against. And that they would only let in a certain race... The only moment where I felt happy was when one of their employees Charles a bouncer in the front was very accepting and nice to us, On our way in and on our way out he treated us very nice and made us feel welcomed. That is truly the only time I felt like D6 was good. Is when Charles made us feel welcomed. So thank you to Charles, you were the highlight of the night and to me the best employee at D6! However the rest of the employees at the front of the entrance need to learn some manners and be more accepting of their own kind of and other races entering their facility.",2018-12-02T13:02:03Z,48
829,D/6 Bar & Lounge,3.6,"I've read so many negative comments about this place, but I still went in to check it out.  I made reservations for 2 at 11pm on a Saturday and was told that we can have a table but they have to close our table at 12 midnight.  We were ok with that.  When we arrived at 1102, we were told that we can have a table but they have to close it by 1130.  We were also told that they don't know who took my reservation but they just don't make reservations for 11pm, and that my name isn't even on the list.  We ended up not getting a table and we were told to just stand around the area.  My husband and I were very disappointed to have been misinformed and they didn't do anything to make up for it.  I would expect an upscale place would take care of their clients.  The place is just very disorganized.  As much as I like the ambience, I don't think I ever want to come back here.",2019-09-22T07:24:17Z,48
830,D/6 Bar & Lounge,3.6,"I go to the casino all the time. Usually Rock since I live in Richmond but I thought I'd check out the Parq Casino to try my luck. I went upstairs to the D6 lounge for a few drinks and wow was I impressed with the way they made the drinks. Nice frothy big huge single square ice cubes and made to the T!! The bartenders here have definitely taken specialty courses in how to make drinks and I didn't even realize they have ""hidden bars"" up here for the high rollers. I will be coming back for sure.",2019-11-18T00:38:09Z,48
831,D/6 Bar & Lounge,3.6,"Spectacular night at D6 last night, with attentive and expert bar service from Daniel - top man and a top night!",2018-12-13T17:30:32Z,48
832,D/6 Bar & Lounge,3.6,"It has a really nice balcony, good for summer parties. Drinks are not expensive. I went there weekday, but there is minimum spending on wknd. For booking u have to email and they dont response fast enough.",2019-05-03T03:36:29Z,48
833,D/6 Bar & Lounge,3.6,Daniel was the first bartender to serve us on a busy Friday night and he was so good to us we ensured we kept coming back to him for the rest of the night. I've been in hotels and F&B for years and I was super impressed with his service. Thank you for giving me and my colleagues a wonderful first experience of D6. We'll be coming back because of you!,2018-07-15T07:15:36Z,48
834,D/6 Bar & Lounge,3.6,Great Vibe. MJ treated us like royalty. I'll be back. Drinks were great and cool venue!,2018-02-26T04:47:44Z,48
835,D/6 Bar & Lounge,3.6,Bad service and overpriced drinks. There's a dress code that is mysteriously applied on and off at different times; I'm not even certain when I'm coming under dressed or over dressed. Overall the atmosphere looks nice but service rips it apart. They need some lessons from the real high end lounges in NY.,2018-04-30T03:23:56Z,48
836,The Pint Public House,2.9,"Got to go and the burger was OKAY. I was super stoked to try the wings today though but after waiting all day for 3pm, I walked in holding my 5 months old and they said I can't come in. I mean, it's a baby at 3pm during lunch, not during a big sporting event with rowdy customers. The baby wasn't going to be getting plastered. Just seemed silly. 

Was just bummed.",2024-02-10T23:16:03Z,273
837,The Pint Public House,2.9,Delicious wings!!  Highly recommend The Pint Burger. Kendra was OUTSTANDING on service. It was both UFC and Canucks night at 6pm on a Saturday.,2024-03-10T04:06:22Z,273
838,The Pint Public House,2.9,"We were in the neighborhood and the fiancé remembered The Pint as being a key place to watch the UFC. Unsurprisingly, the place was packed and we were directed towards the basement of the pub in our search for an unoccupied table.

The atmosphere struck me as a no-frills pub. Low ceilings, dark tables that have handled many spills, and generally a place where the patrons care the most about the value of their beer, and having a good line of sight to one of the multiple TV's posted around the room. We had our respective drinks and shared a giant plate of nachos. The place got quite a bit hot and stuffy (given the sheer amount of people) but the place did their best with the loud industrialized fans. We left as the UFC program was coming to a close.

Overall, service was good and friendly and we had good banter with the waitress that served us. A place for good beer, solid pub food, and a ""no-frills"" atmosphere.",2022-09-05T19:35:56Z,273
839,The Pint Public House,2.9,Went to watch a Canucks game with friends and only showed UFC. Do not go here to watch hockey.,2024-03-11T17:34:50Z,273
840,The Pint Public House,2.9,"Come a bit earlier to secure a table as seats are hard to come by after 6pm.The place has very good vibes and the waitresses are very cheerful and attentive.Lots of Sports fans and tourists and TV sets.Menu items however are lacking in variety ,like I wanted chicken wings not deep fried Cauliflower,so I decided not to eat.All in all I was with a friend and felt safe and comfortable in a bad part of town.",2023-12-13T09:23:02Z,273
841,The Pint Public House,2.9,"Made an online reservation so we could watch our Denver Nuggets close out Miami in game 5 of the NBA finals while visiting Vancouver only to find a locked and darkened establishment that appears to be a tax seizure or something of the like.

No real review here other than to say they were closed for business when we needed them most. Fortunately we were able to watch the deciding game somewhere else nearby.",2023-06-14T01:34:03Z,273
842,The Pint Public House,2.9,"the last visit to the Pint after many nights watching the Canucks.  
came to watch Leafs Canucks, but most televisions showing NFL and UFC. 
refused to even have volume of hockey in the establishment.  
unfortunate that they have changed their vibe so completely. 

my first yelp review had to be this unfortunately.",2024-01-21T00:22:42Z,273
843,The Pint Public House,2.9,"This bar, that sits on the corner of needle central in the worst part of Chinatown, expects me to pay a cover charge? HUH?",2023-11-22T03:18:02Z,273
844,The Pint Public House,2.9,"Decent food and drinks, but I never go because you have to go through such an ugly part of town to get there.

And why does this place charge cover? Pint, you are a PUB. Not a nightclub. Learn your place and stop being greedy.

2 stars. Do not recommend.",2023-04-11T02:03:06Z,273
845,The Pint Public House,2.9,"Huge thank you to a wonderful employee at the Pint working at the bar, who let me duck in when they weren't quite open because a nutty homeless guy randomly started chasing me. He also expertly deescalated the situation which  could've been a lot worse. Grateful",2023-07-21T23:13:49Z,273
846,The Pint Public House,2.9,"-We had to pay $10 cover to watch TV with no sound 
-When we sat down and got our food and drinks the security came by and told us that we have to leave our table because they were making space for a dance floor
-There were no tables left, so everyone in our group of 12 had to eat standing 
-It's $14 for completely average 3/5 burger by the way 
-Extremely expensive drinks: $9 for a pint of strongbow 
-Mandatory 16% tip included in the bill, was then promptly offered to include more tip when paying by debit card",2014-12-20T05:54:34Z,273
847,The Pint Public House,2.9,"We were pretty desperate when we came here and honestly could have eaten anything. This place, however, was horrible. The service was incredibly slow for us being the only clients in the place. The food was really terrible. Some of it was not edible. The poutaine had cold cheese, the mac and cheese was literally yellow, and we had to pay $1 for a side of mayo. I would suggest to steer away from here.",2017-04-15T05:19:00Z,273
848,The Pint Public House,2.9,"Great hangout place for friends. Atmosphere is very chill and always busy.
Great Wings (probably the best in town) 
Beer selection is not the best but that's ok when you got greasy food and good company.",2018-02-27T05:50:08Z,273
849,The Pint Public House,2.9,"If you just want the 30 cent wings and don't give a rat's ass about service and aren't afraid to grab attention (literally) from the servers when they ignore you. Then yes, cheap wings in 40 flavours is quite a deal!

For those who have even an ounce of care for and expect some minimal service, bewarned!

The only reason why I've been coming back to face the nightmarish service is only because the Key Lime Chili flavour wings are the best I have yet to find in Vancouver...just be prepared to order right away when the server comes -- otherwise it'll be like catching a bar of slippery soap.",2014-06-18T19:27:58Z,273
850,The Pint Public House,2.9,"I spent over $400 in alcohol at this establishment and couldn't get a buzz. One of the worst pours I have ever had, every drink in the small cups which gets spilled out with the tight crowds of people pushing you on your way back to the table which was ""chilled"" mixed with water as their preferential delivery method. That's a good way to make lots of money on little alcohol and to keep the orders coming.

The downstairs area became very hot quick like they turn off the AC when they convert from restaurant to night club. The table we sat at had a strobing light in which they made a light effort to fix and then said..meh, whatevers.

The upstairs area turned very full and young. A bit rude here when it gets late which was a reality check since everyone was so darn Canadian friendly during the dinner hour. 

I would recommend people go to this place for fun events or dinner and then get the heck out!",2015-03-18T20:38:12Z,273
851,The Pint Public House,2.9,"The DJ was awesome! Played great hip-hop and rnb music. The mixed drinks were really good, and the bartenders were friendly. NOTE: There is a $10 non-biased cover fee for getting in, which is reasonable since this isn't your average bar. In the wee late hours it turns into a club real quick - hence the good hip-hop/rnb music. Definitely recommend this place if you're a tourist like me looking for a classic bar to go to with your friends!",2016-08-14T00:56:50Z,273
852,The Pint Public House,2.9,"Sports pub first... Fun and casual during non-nightclub hours. The choice of pub food could include a cheese and fruit board but overall it's good enough. A 16 oz. T-bone would be great not to mention huge salads too but the big attraction is the servers. Nice women that happen to be fun, gorgeous and pleasure to tip well. Specials, great wings, cold beer and beautifully interesting servers... What more could anyone expect from a 300 person beer hall-pub? Free wings? They've got them with a pint from 3-6 M-F. I enjoy everything about this place except they have a few too many male bartenders. Huge blunder but workable.",2013-12-14T04:22:48Z,273
853,The Pint Public House,2.9,"They tried to scan my driver's ID through some machine without even asking when I first walked in. Then when I asked them what they were doing, they responded, ""Why?  Do you have something to hide?"".  Amazing.  Not trying to hide anything, just don't want you to have all my personal information.  And you need to ask first before you try to get it people! They also take your picture when you come in. I'm not making this up. 

Used to love this place--but crap like this is going to sink them.",2012-12-30T06:10:51Z,273
854,The Pint Public House,2.9,"Had a big birthday here last night. Our server was great,  very kind and attentive. One thing that was very disappointing: The kitchen and bar refused to provide something special for the birthday guest. I understand when during rush that things can be difficult, but how much effort does it take to put a candle in a desert or provide a free shooter? I was a bar manager so I know exactly how much effort it takes.  
Better options for a birthday party would be Rogue kitchen and wet bar or really anywhere else.",2015-02-07T15:05:33Z,273
855,The Pint Public House,2.9,"I'm in love. After experiencing the pretentious, overwrought disappointment that was Honey Lounge, I can't tell you how excited I am to see an affordable neighborhood pub open up in its stead. I'd give this place 5 stars based solely on the merits of it NOT being Honey. But wait, there's more!

-They have towers of draft (something I haven't found in Vancouver since Fogg 'n Suds stopped selling them).

-They have 40 different varieties of wings (We managed to try 12 of them during our visit. My recommendation? Stick to the BBQ variants. The rest were undersauced and bland).

-They have 30 CENT WINGS ON WEDNESDAYS. That's $4 for a pound. We went through 12 pounds and 2 towers of beer and our bill worked out to less than $20 per person. The daily happy hour special is pretty ridiculous as well.

-They literally have a billion TVs. I don't think there was a blind spot in the entire (gigantic) space.

Friendly staff, cheap wings, copious amounts of beer, and it isn't Honey. I'm never leaving this place (seriously, I'm posting this from a crawlspace in the bathroom that I've claimed as my own).",2012-04-03T20:07:19Z,273
856,The Pint Public House,2.9,"I was here on Sept 28th Saturday for early dinner/Happy Hour dinner with my sister to use our gift card. Two of us ordered the following: Hoegaarden ($8.50), wedge fries ($5) and Pulled Pork sliders ($5) with free wings. 

Pulled pork sliders were tasty and delicious. Fries were soggy and precooked we didn't like it at all. We had Mango Chipotle wings for the purchase of the drink; it was so gross. Wings came out fresh; however, it was pretty salty and had no taste of mango. Why would it be Mango Chipotle without any mangos in them? No clue. 

Hoegaarden was not bad, but wings left us feeling very thirsty after finishing our meals. Few hours later, I ended up drinking lots of water to wash down the sodium. Happy Hour was a great deal, but I didn't find the food to be memorable at all.",2019-10-20T20:31:37Z,273
857,The Pint Public House,2.9,"It's been a minute since I have been to Vancouver. About 2 1/2 years. This might have been the last restaurant i went to, the last time I was in town. Google said it was 3 years ago. But I think I did enjoy my last visit, so I walked over a mile for another visit. They were having a special on wings, half off. So I got an order of wings, with maple bbq sauce. They do charge extra for the celery/carrots (didnt not ask if I wanted them or that there was a charge) and extra for the dipping sauce. Their wings are very very small. BUT, I dont see that as a problem. There is a lot of meat on them and easier to fit in your mouth. The sauce was a good. Had a small kick to it. I also got an order of hummus and veggies. The bartender initially forgot to put the order in. But, no big deal. It did take a while for the wings to come out. And, when they did, they were just on the warm side. So, they might have been sitting out for a little bit. But, again, they were still good. The hummus was ok. It seemed like it was lacking flavor. They didnt skimp on the veggies, though. It's a pretty good joint. Would visit again with no hesitation.",2022-03-06T03:11:22Z,273
858,The Pint Public House,2.9,"A few months ago, I had my first escape room experience (we were successful)! But prior to that, we enjoyed some appies and drinks (perhaps the drinks helped ) at the Pint, as it was close by.

We ordered wings, poutine, and nachos. They had some deal going on at that time of if you bought certain beers, you'd get some free wings.. so a few of us took advantage of that.

The atmosphere is the same as any other pub-type place. Lots of TVs around to watch sports, high stool chairs and tables, and loud and lively all around. Fun times!",2020-02-08T22:10:26Z,273
859,The Pint Public House,2.9,"Well. Here ya go. Wish I could say more. Our server said ""well these are probably the healthiest wings because they aren't injected with steroids.""",2022-01-06T06:34:26Z,273
860,The Pint Public House,2.9,"Momofuku-2/5 too much seseame oil.   Taste like ramen 
Caribbean Jerk-2/5 not bad.  Nice kick but was expecting better
Insanity-1/5  Too spicy!  Honey Garlic-3/5 decent.  Ah what the hell, there are too many wing flavours for me to review!!!!   I think they have over 40 flavours here off the top of my head and it used to be that you would get a free basket of wings here during happy hour on Wednesday if you ordered a pint of beer.   They used to do a free basket of perogies here Thursdays with a pint of beer as well.  I've had many fun nights here on the weekends and I would recommend you get here early before the line ups and cover start.  But with such a huge space including the basement this bar still gets really full on the weekends.   It's a great place to watch sports and TeeJay is an awesome bartender if you ever get the pleasure of having him serve you.",2019-02-24T08:05:32Z,273
