,name,overall_rating,review_text,date,review_count
576,Harbour Event Centre,2.7,"I love this venue.  Always a great time and they have the sickest DJ's that get flown in.  It is never boring and they treat me right over there.  Great management and sound.  The lights and screen is top notch, they even have some kind of smoke blasting devices.  All in all I'd keep going back and would recommend it to others!!",2020-01-26T01:28:22Z,9
577,Harbour Event Centre,2.7,Every time I've gone here the washrooms are always disgusting and I swear they water down their drinks... I ordered vodka shots twice and they were not nearly as strong as they should be; for $10 a shot I definitely felt like I was being cheated.,2018-01-29T04:35:38Z,9
578,Harbour Event Centre,2.7,Okay venue pretty big when they host events it gets pretty cramped and everyone sticks together like glue,2017-10-13T14:27:47Z,9
579,Harbour Event Centre,2.7,"Harbour Event Centre is my favourite club. This club has a positive atmosphere, strong drinks, and great DJs at an affordable price. Always a good time coming here because it is very spacious and their visuals are the best in BC by far.",2017-03-31T01:34:49Z,9
580,Harbour Event Centre,2.7,"I love a good party and have never been picky. But my friends and i went to the insomnia afterparty at this venue. Literally called ""Insomnia Afterparty""
First off no backpacks allowed which makes no sense when these after party people are coming from a rave/music festival. Of course 1 out of 3 people have a backpack
Second i messaged them asking about their backpack policy prior to see how strict it was ( i messaged them a week in advance) no reply. 

Thirdly not a single place to sit down except vip tables which are extremely costly. Id think it was common sense that the crowd they were attracting for that particular night had been dancing at an EDM concert since 7pm and would be in need to sit down. Security would kick off anyone sitting on any steps and staff wasn't too nice when we asked if there was anywhere to sit. 

Insomnia event was great. The afterparty at this venue sucked. And unfortunately it was the venue's fault. My friends and i will not be back next year for sure!",2017-03-13T06:50:18Z,9
581,Summer Salsa Cruise Series,5.0,"Always have an amazing time on this cruise. The tickets are cheap, it's a great crowd, the crew and staff are friendly and helpful, and it never has the Granville Street vibe.",2017-05-21T01:10:40Z,1
582,The Lamplighter Public House,3.1,"The thing about this place is the weird bartenders.
By 'weird' I mean the sense of humour is above and beyond the norm.

Fantastic Monty Python vibes. 


(I am giving it a 4even tho they have a wack dj on fridays)",2023-10-29T08:26:28Z,268
583,The Lamplighter Public House,3.1,"Decided to pop by for a quick beer after not coming here for over a decade.

Inside still looks the same, with the vintage ceiling and trim. They seem to have removed the bench seating though. Now it has more of a nightclub feel, with a dance area in front of the bar.

There are still some arcade games (including the ones where one throws a football or basketball etc.).

Only comment is that the music is definitely at nightclub levels. In other words, too loud to have a conversation. I think I'm getting old.

Not sure if I'd be back. Rather find a quieter place to chat. But it's a decent choice if one wants to dance and go deaf.",2024-04-02T07:06:52Z,268
584,The Lamplighter Public House,3.1,"Set in Gastown right along Water Street is the Lamplighter Public House. I came here on a Tuesday for dinner, drinks and to join the trivia fun. 

The group of us were split amongst three half-moon tables that can comfortably sit 6 people each, so we decided to squeeze 8 in. The service was very attentive, we were greeted and drinks orders were taken. When it came to food, that was another story. Half of our table received their order while the other half had to inquire on the status of their meal. 

I ordered the grilled avocado and crispy tofu bowl and it was disappointing. It was a salad without any taste and just had some spicy kick in the tofu, I felt misled by the description. I heard similar comments that the rosemary fries were too salty, the handmade dumplings were not appealing. To drink I ordered the Oh Doctor! which I also found disappointing, it was more tart and less creamy than I expected. After that, I switched to the Red Wax Drip and this was more my speed, like a moscow mule but with fruit. 

The trivia host was pretty great and brought a lot of energy to a large group of people. It was a fun night, I just wouldn't recommend eating here. It's pub-style food, so keep those expectations low.",2023-10-20T22:40:32Z,268
585,The Lamplighter Public House,3.1,"My go-to place for a fun night out in Vancouver! Main reason why I like Lamplighter over other clubs is because they always play music that everyone can dance to!! Whether you like EDM, pop or R&B, they will have something for you. 

Their entry fee is quiet reasonable and their bar service is quicker than most other places. I have never had a bad experience with the bouncers. 

Also!! Their brunch menu is quiet reasonable:)",2023-07-17T16:17:12Z,268
586,The Lamplighter Public House,3.1,"Visiting from Florida. Loved the Lamplighter as well as the staff!  
Jenna and Ethan were amazing.",2023-06-08T21:27:33Z,268
587,The Lamplighter Public House,3.1,This place has excellent service. We we're tourists on a long trip and came in for bingo on Thursday night. The bar staff was incredible and kind. The food was good. And the bingo was lively and fun! This really made our night! We will definitely be back!,2023-07-21T04:41:32Z,268
588,The Lamplighter Public House,3.1,"Okay in town for a day and stopped in. Food was amazing, drinks were on point and the staff was fun I asked the bar tender Ethan and our server Jenna for recommendations.  Everything they suggested was on point! Thank you for a great time!",2023-06-08T21:26:42Z,268
589,The Lamplighter Public House,3.1,"Great spot to chill and hang, I suck at games so money was stolen lol. Definitely a good spot to come and stop in!",2023-01-08T04:46:32Z,268
590,The Lamplighter Public House,3.1,Great service and a VERY expansive draft beer and good wine lineup.  Can't vouch for the food as I did not order.,2023-08-11T22:52:36Z,268
591,The Lamplighter Public House,3.1,This place has the worst event management. We paid for New Year's Eve event tickets and waited in line for more than an hour. The bouncers have let individuals skip the line for $40 a head instead of letting people who have pre paid in. Lamp is a disappointing establishment managed by a bunch of buffoons. I could run this bar better with my eyes closed and no hands.,2023-01-01T07:21:48Z,268
592,The Lamplighter Public House,3.1,"Wow. This place has REALLY improved since the new owners took over.

A good size dance floor, atmosphere and DJs are playing the hits.

I'm only taking away a star because they were playing Pulp Fiction on TV at the same time the dance floor was ripping. Why, Lamplighters? Everyone and their mom has seen that movie. Turn off the tv and focus on being a dance club. We can't have everything.",2022-08-06T22:28:03Z,268
593,The Lamplighter Public House,3.1,"After walking around and checking out the sights, we walked into the Lamplighter and ordered some beers. It's a Donnelly group establishment and I've since learned that they own a lot of the bars, lounges, and pubs around Vancouver. My friend was interested in their sours and I had one of the ciders. The server was nice enough to bring us a taster and we tried it. My friend really liked the blueberry one so that's what she ordered. I ordered the Northyards cider. They brought us a spiced nut snack which we devoured while having our beers. It's a dive bar that was fairly empty on a Thursday night. There were a few patrons who came and left. A few more stumbled in later than we did. The open space had pinball machines, TVs, and a speakeasy next door with craft cocktails that we both decided we should have ventured into first. It was a chill spot on our little tour of Vancouver.",2019-08-30T15:25:30Z,268
594,The Lamplighter Public House,3.1,"A-MAZ-ING!! Definitely a five-star place. Having never been in Vancouver and looking for a place to eat straight off a delayed plane, we saw a bunch of restaurants in the north end of the city. So, we decided heading there would lead to some sort of delicious meal, and we were so right!

We saw The Lamplighter, and since I vaguely remembered it from my research as being a good place to eat, we decided to give it a go.

The ambiance mixes Victorian and dive bar (pin ball machines and a pool table!). It's quirky, and it works.

Similarly, I noticed their food expertly pairs acid and savory together. I ordered the kimchi grilled cheese, which fairly obviously mixed the sweetly acidic kimchi with the savory cheese. However, my husband ordered the French dip. The meat was marinated in something with an an acidic flavor. Dipping it in the thick sauce paired those acidic notes with sweet yet again. To me, this seems to be a signature pairing because my ""side salad"" (with goat cheese, dried cranberries, blueberries, and strawberries) paired those sweet fruit flavors with the savory of the cheese and the acid of the vinaigrette. Top-notch flavors.

Of course, this is a beer place. The Lamplighter offers a plentiful local beer menu, all on draft. Both my husband and I enjoyed two of their unique beers. I drank the Red Truck Bourbon Berry Ale, while my husband sipped the Bomber Park Life Passion Fruit Ale. Both were pretty good. I am no beer expert, but I actually enjoyed the Bomber more because the passion fruit notes were quite strong.

Overall, we had a great time. The food was good -- I am still dreaming about those sandwiches! -- the service was good and prompt, and the beers g. I would definitely come back here in a heartbeat!",2019-09-20T04:42:06Z,268
595,The Lamplighter Public House,3.1,"Busy bar with a large beer selection.  Seating inside or in the fenced off sidewalk patio. It's self seating so you got to be sure to let them know you want to be served.  

The first time I tried them I felt largely ignored. In fact we left after 15 minutes because the waitress stopped by two times to give us menus by but would not stick around long enough for us to give her the order.  We knew what we wanted.  Crazy.  Just too much of a hurry. 

Came back the next day to try again (there was a beer we really wanted) and this time managed to get two beers.  Whew.  It was good beer.  With service like that though it's not a place I would opt for regularly.",2017-08-13T15:08:35Z,268
596,The Lamplighter Public House,3.1,"Loud busy pub with lots of beer variety to choose from.
Seating is a challenge on weekend evenings. Find your own spot as the servers are not around to help you. You may feel unwanted and ignored at first but once you find a spot service should pick up.
Regarding Food - Chicken wings were Ok. But their blackened chicken burger was delicious. Veggie quinoa burger was good too. 
3.5 stars would be perfect for this place.",2017-09-24T07:39:21Z,268
597,The Lamplighter Public House,3.1,"Here I am Sunday morning to hang with a mate who's a big Man U fan.

The Lamplighter is the official pub for Manchester United footy supporters. 20% off meals with Man U card.

During game day - the menu is preset so I went with the Bacon Butty comprised of a fresh French roll, smoked bacon & eggs. Tasted very good. Now this is early morning so I probably could have eaten a horse as the saying goes, & still been satisfied.

My friends both ordered the Man U breakfast - their usual & both swear by it as top notch.

The Lamplighter is truly an old time classic pub that's been a mainstay in Gastown for decades. Located on famous Water St at Abbott St, there are lots of restaurants & shops nearby.

Alcohol is served at 9am - cheers. Oh & did I mention that I'm a huge Liverpool FC supporter! I survived being at the Lamplighter by not worrying a Liverpool jersey. LOL",2017-09-17T20:32:50Z,268
598,The Lamplighter Public House,3.1,great service! great vibes! Make sure to bring cash for the bar! Such friendly service,2022-11-13T07:50:58Z,268
599,The Lamplighter Public House,3.1,"This is a place recommended by the locals with great music, nice sitting areas, different popular tv show games and a pool table. 

Space can be a bit tight, so I don't recommend it if you like to have plenty of space to walk by. 

Very nice service.",2017-07-23T18:39:16Z,268
600,The Lamplighter Public House,3.1,"I stopped into this pub for lunch before going to a conference. I'm from out of town and was looking for something decent and healthy to fill my belly. 

Ambiance: the pub is large, with fairly typical pub decor and lighting. Definitely a sports pub, as there are televisions throughout, featuring baseball and soccer.

Food: I ordered the kale salad, which was very decent. Apples, chicken, goat cheese, beets and almonds all chopped small for easy eating. I felt healthy eating this salad. Because I was going to a conference and not sure when I'd be eating again I also ordered the sesame pretzel. This was delicious, piping hot, with just the right amount of saltiness and the toasted sesame seed were a nice surprise.

Drinks: I didn't order a drink, but they have a pretty extensive beer offering and modest hard alcohol shelf.

Service: I sat at the bar and the service was average. Bartender was nice, but forgot one part of my order and I had to ask for more water. No problem, though, I wasn't in a hurry.",2017-04-20T19:29:56Z,268
601,The Lamplighter Public House,3.1,"Lamplighter public house was the first restaurant or pub we tried in Vancouver and I must say... I was a bit disappointed.

Atmosphere - Located near the Gaslamp district, Lamplighter looked like one of those old school, yet still hip bars to go into. Inside its completely open with TVs everywhere, pool tables, and pinball machines to play before, during, or after your meal. There was a lot of people when we went and the volume was definitely that of any other beer house or pub. 

Food - This was the first time we were going to try actual pub food from Canada and we were super excited! Luckily, they did not disappoint at all! We ended up getting the brisket poutine (pictured) to start off as an appetizer and it was delicious! YUM!!! The brisket was amazingly tender and the egg was a great garnish. As for the burger, I got this huge mushroom & swiss burger with onion rings loaded on top (pictured). I don't necessarily know the name of this burger but DAMN was it good! It was so big I had to split it up as I was eating so I can enjoy every little bite. 

Service - The reason I had to take off a few stars for my review is that it literally took us 20 minutes to get menus, another 15 minutes to order, and another 30 minutes to get our food. The wait to get anything was super long and our waitress was nonexistent during our entire time there. We had to call over other waitresses to try and get drinks, silverware, and extra sauces. I guess we can chalk it up to a busy night, but regardless the wait time was just too long for our taste. Especially after a full day of tourist activities...

I'd recommend this place to friends, but I'd advise them not to go if it looks too busy and packed. It might turn into a 2 hour commitment if so.",2018-08-30T02:07:30Z,268
602,The Lamplighter Public House,3.1,"Classic pub in old Gastown. Another stop on our one day layover in town.

It was Sunday around 2pm the place was heaving. Football games on every big screen television. 

We sat at the bar and got a couple of Parallel Lower 49 lagers. Light and crispy. A tasty local beer. 

We did not eat here. Basically a sports bar. Crowd was in a good mood. 

Mark.",2018-09-17T18:44:28Z,268
603,The Lamplighter Public House,3.1,"After our disappointing visit the first time, we came back here a second time with another reservation, and a dinner courtesy of management. Our experience was MUCH better!

This is a solid spot for drinks and appetizers, especially if you're walking through Gastown. The service is fairly good, barring the passive aggressive hostess at the front (we were spoken both the first and second times with attitude, not sure what the deal is there).

We got the brisket poutine, fish and chips (subbed the chips for yam fries). Would highly suggest the brisket poutine!",2018-08-10T21:41:36Z,268
604,The Lamplighter Public House,3.1,"Went to the lamplighter around 9:30 on a Friday night. Service was okay. The bouncers were very nice and friendly. As the night went on it definitely became less enjoyable. Lots of belligerent patrons and glass all over the floor and in the bathroom. Other than that, great drinks and music!",2022-03-19T20:29:13Z,268
605,The Lamplighter Public House,3.1,"Service: 5/5! Fast-paced, Alert & Engaging. Why expect less from Gastown. With the amount of foot traffic in that area, the service is indeed topnotch.

Interior: 2/5 Grungy & dark ambiance. Resembles an upscale dive-bar with retro decor including plenty pinball machines & railway timetable-style signs to broadcast their beer menu. 

Beer: 5/5!!!! Great variety & playfully broadcasted on their old school menu above their bar.

Food: 3.5/5 The burgers are heavenly & the wings were spicy [Buffalo Sriracha]. Nothing more & nothing less. Great go to pubfood.",2018-06-12T16:23:45Z,268
606,The Lamplighter Public House,3.1,"We stopped in one afternoon craving nachos and a beer and we were not disappointed. Nachos were huge with lotsa cheese (and no we didn't order extra, it just came like that), lotsa sour cream and salsa (again, it came like that), and lotsa deliciousness!  Our waitress was great (she kinda reminded me of Scarlet) and she was excellent in helping us choose a beer!
  Will definitely recommend this place located in Vancouver's most awesomest neighbourhood!  
  OH YA, and the have a Star Wars pinball machine!  How cool is that?",2018-06-03T05:31:13Z,268
607,The Lamplighter Public House,3.1,"MUST GO FOR HAPPY HOUR! 

All domestic beers are $5. Imports are $1.00 off. 

Gorgeous and spacious interior.

I had the Lonetree Pear Cider for the first time and fell in absolute love. 

Would absolutely recommend!",2018-04-09T00:14:15Z,268
608,The Lamplighter Public House,3.1,"Ok, so maybe I'm too old for places like this. I never thought I'd say that, but perhaps it's true. 
My husband and I recently came here and it was PACKED (it was a Saturday evening and, to compound matters, it was ""Dine Out Vancouver"" week). The hostess was lovely and said they had one available table, in the middle of the main dining room, and she lead us there. The table and chairs had food on it, so she apologized and wiped it all down. Hubby and I sat down but we could not hear each other talking. It was THAT loud in the restaurant. We sat but three feet from each other, if that, and could not hear each other. And the restaurant interior was so dark, like, SO SO dark, and the row of video arcade games beside us were so bright in the dark room, with their neon, glaring lights..... It was too much for us old fogies! 

Argh, I never thought I would be the ""old person"" in the room. What the hell happened?

Anyhow, I'm not sure if this place was darker and louder than usual when we visited or if this was their baseline ambiance, but be forewarned, this pub is not the place to go to unwind! It's more raucous than most pubs, but if that's what you're into, I'm sure it would fit the bill.",2017-02-01T08:50:22Z,268
609,The Lamplighter Public House,3.1,"Met up for a Yelp event at the Lamplighter on a recent brisk evening.
Even at 5:30 the place was loud and a little too dark for my liking.  Almost cinema dark!  Not conducive for Yelping photos - apologies for the poor quality.   I'm guessing this was on account of the Seahawks game already in progress.  

Lots of TVs around, and also a couple projection screens showing the football as well.  Never mind having to shout across the table - I had to pretty much shout to the person next to me to chat.  They have some nice long tables and booths to sit in, but by the time we got there these sections were busy and wouldn't accommodate our large group.

We ordered two pizzas to share - both Margherita with basil - simple but really good.  Nachos were pretty good, and the salted pretzel bites were easily one of the highlights of the night.  I stole a few yam fries which were also excellent.

I sampled the Rose All Day cocktail which had dodka, watermelon, mint, basil and lemon juice.  It was sweet and although small in size packed quite the punch!  I had the misfortune of ordering a Kronenbourg Blanc just before our party's five minute warning which left me with more drink than I could handle.  Thank you Karen for coming to my rescue!  Next time I would try the Garden Gimlet which has Kronenbourg in it.

Service was good - waitress was around several times for food and drink orders and didn't take long to deliver the goods.  The place got busier while we were there - I just wish they didn't substitute volume/darkness for atmosphere!!!  Perhaps a bar isn't the ideal place to relax after work, though I wasn't expecting dead quiet.  I would go back but would make sure that there's no football on.",2015-10-23T22:49:59Z,268
610,The Lamplighter Public House,3.1,"Classic Donnerlly Group PUB... lets face it they are all good and they are all just that little bit different from each other; whilst still be similar at the same time.  
Have a look at their web page.  There is always something on offer to tempt the individuals or groups.  
""Gastown Beer Society"".. well who would have figured,  a beer society at a PUB.  Excellent.  
""Manchester United FC"" . theo official MUFC supporters club in Vancouver.  a big plus from me. :)",2017-02-09T16:54:08Z,268
611,The Lamplighter Public House,3.1,"- Pool table and games 
- Seat yourself style 
- Was estimating to stay 30 minutes for a drink, but had to stay over 1 hour as it was difficult to call for service.",2019-08-28T23:52:35Z,268
612,The Lamplighter Public House,3.1,"Friendly service. They do serve brunch, lunch, but definitely more of a bar feel.  For Saturday brunch it was not really busy.  Beer was good.  Cold and glassware was clean.",2019-10-05T20:21:10Z,268
613,The Lamplighter Public House,3.1,"I really enjoy this place, not only because they have good vibe, music and great food, but mainly because they provide an amazing service, 
it is a perfect place to have good food and fun at the same time, I recommend trying the shogun drink as well, one of my favorite, on Fridays they have good Djs and you can't lose it.",2019-10-05T22:24:26Z,268
614,The Lamplighter Public House,3.1,"I always have a great time when I go to this place. Since I walk up to the coat check, I get greeted in a nice way.

The drinks and food there are good. I suggest the Mojito (one of the best I've had) and the mushroom pizza - really tasty. I didn't expect such good food for a bar/pub.

Servers are always gentle and helpful, but even better they are paying attention to the customers needs. I love when I need something, lift my eye, and they just know it and come right to attend. It's great, keep it up with the awesome service!",2019-10-08T19:05:38Z,268
615,The Lamplighter Public House,3.1,"We stumbled upon the Lamplighter Public House today for lunch. I was a bit concerned as their menu outside was a true lunch menu but when we went inside, they were serving a Sunday brunch menu. Luckily, they had the Hangover burger, so we were able to get something a little heartier than eggs. Have to say, it was amazing. Totally different from the flavor one would expect from a burger. The sauce was a mustard seed sauce and the cheese had a kick. It had an egg on it as well though we opted to have it without the egg. I had the hand it hash towns which were more like potato wedges and my hubby had the fries. The meal for both of us was great!

And on top of that, it was a great sports bar! So if you want something different than the Spaghetti Factory (which the tour guide recommended), I would highly suggest the Lamplighter.",2016-09-19T04:32:48Z,268
616,The Lamplighter Public House,3.1,"I had my bday party at The Lamplighter last night. Gabe, the night manager, and another guy whom I don't recall his name (blue shirt, very cute) were fantastic! They did their best to make sure we had a great time. DJ was great! Best chicken wings I have ever had! 
Very good experience, I will definitely go back! :)",2019-03-10T21:20:34Z,268
617,The Lamplighter Public House,3.1,"Our hunt for poutine brought us here.  It's loud and dark and best for groups.  We already had dinner so four of us split the POUTINE LYONNAISE.  I've never had poutine before and this one came topped with bacon onion gravy, cheese curds and a soft poached egg.  I don't generally like my fries soaked with sauce, but these were surprisingly good!

I also had the BEER FLIGHT, which is a great deal at $4.75!  You can choose any three beers and I decided on three local ones: Granville Island pale ale, Granville Island lager and Driftwood white bark.  A great way to start off our trip!",2015-10-07T03:18:51Z,268
