,gym_name,overall_rating,review_text,date,review_count
272,Celebrities Nightclub,2.8,"I went there a few weeks ago on Tuesday night. Music was really good, but line up outside was really long. Our group had to wait for almost 40 mins to get inside but was worth the wait, we had a great time.",2019-04-10T06:36:21Z,124
273,Celebrities Nightclub,2.8,"Attended Bingo for Life last night and have a new favourite Wednesday activity!!! 
~$10 donation gets you a set of cards and a dabber. If you have 6 or more people, you can reserve a table, otherwise come around 8pm when the doors open so you can make sure you get a seat! It appeared to be quite dead when we arrived at 8 but the place definitely filled up. The games go from 9-11pm with a couple of breaks and are fan-tastic! 
The games are super easy and the hosts are hilarious. Prizes include gift bags of goodies and while some items are definitely meant for the gentlemen of the crowd, there are still lots of fun gifts for everyone! 
Good luck charms don't hurt to have with you either!",2010-04-29T16:49:59Z,124
274,Celebrities Nightclub,2.8,"I've been to Celebrities for events and it's a good spot but for just a general night out...not the hottest place on Davie.  The crowd is diverse and friendly and the music is pretty good but the atmosphere is not-so-fresh.  

I have only checked this place out on a Friday and hope to see it again on another night to get a better feel of the joint as I'd like to give it another shot.",2009-02-08T00:42:14Z,124
275,Celebrities Nightclub,2.8,"The other night was my first time coming here. I don't usually go to clubs but I wanted to see the Pendulum DJ set. (I think I was one of few people who actually was familiar with Pendulum's music).  

As the place started filling in it slowly got really crowded. I knew the event was sold out so that was to be expected.  

I questioned if it was over crowded because it got to the point where if you were on the dance floor you were likely to take an elbow to the side of the head or something. Plus if you left to to the bar, good luck trying to get back to where you were. 

Bottled water costs $4 not sure about prices of alcohol since I didn't drink that night (was driving home)   

Staff members were awesome. at the end of the set, few of us fans stood by the side of the stage area in hopes for photos and such.  The security let some people in and rejected others but he said I can get a photo because I was waiting patiently.  For me this was great because I ended up getting a pic with one of the founding members of the band. -- so thanks super awesome security guy!  

Overall I had a really fun night and perhaps I'll go back sooner then I think.",2013-11-01T18:26:45Z,124
276,Celebrities Nightclub,2.8,"If you are American or have been to a good nightclub in your life do yourself a favor and skip this ****hole. staff makes you wait outside all night to buy tickets legitimately but they regularly sell ""VIP"" tickets away from the cameras to bougie douches for twice as much. If you get in its mediocre at best. Tragically overpriced and the crowd is a bunch of 19 year olds. Also they make you show two forms of ID so if you are American you have to enter this sketch joint with your ID AND PASSPORT. seriously screw that my American ID is good enough to get into this  country it should be more than enough for a third rate ""nightclub""",2018-06-09T07:04:05Z,124
277,Celebrities Nightclub,2.8,"On a Saturday night, when you don't feel like waiting in hour-long lines or paying for cover - this is one of the closest and fun places to be!

I came on a whim from a Seattle vacation with a car-full of friends and did not expect the clubbing scene on a Saturday night in Vancouver to be like Vegas. (It is very similar, if you were wondering)

This place was so fun! Waited in line for about 15 minutes. Coat check worked like a charm. The music was great and the club didn't have many creepers.

I frankly don't understand why people were waiting in line for hours on end at the clubs and bars on the main street. They were still waiting when I came out of Celebrities...

To each their own.",2012-08-04T01:51:23Z,124
278,Celebrities Nightclub,2.8,"I go to Vancouver with friends every now and then to hang out, this past weekend was the first time that I've bothered to go to  Celebrities, since we got on the guest list.

It was about what I'd expect. Drinks were fine, music was the usual. Nothing too terrible. My group and I did end up getting split up because the guy told my [totally sober] friend (who was just tired from walking around all day) that she was ""too drunk to go in"". She was literally completely sober. So one less star for that.

But it was cool. I'll go back at some point.",2014-04-07T16:53:07Z,124
279,Celebrities Nightclub,2.8,60 dollars is the most ridiculous cover fee. Came to visit Vancouver and was treated disrespectfully by the staff. Very disappointed.,2018-12-29T10:04:33Z,124
280,Celebrities Nightclub,2.8,"The lines are waaay too long, and the cover is too expensive. Not worth it, to be honest. The bouncers are very rude, and once you get inside, you'll find that the music is mediocre and boring. Furthermore, if you're looking for a gay bar, I would recommend that you go elsewhere. From my experience, the crowd is mostly straight, despite this establishment historically being a gay club. This place is super overrated. Not worth the wait or the cover.

I don't think I'll be going back.",2016-12-17T23:02:47Z,124
281,Celebrities Nightclub,2.8,"Wow straight up fuck the bartenders here, I gave a 50 and the bitch at the bar said I gave her a 20 we were going back and forth about it for like 20 mins, what kind of shit is that? I am an excellent tipper but do t steal my money you assholes",2015-04-26T17:34:24Z,124
282,Celebrities Nightclub,2.8,"I went here for Celebrities infamous Tuesday Nights and man was it an epic party. The line was possibly the biggest I have ever seen in my life for a Tuesday night, possibly a block deep in both directions. The new renovations make the club the premiere destination for those looking for a good time. When I entered the establishment the place was packed and everyone looked like they were having a good time. The staff here are completely amazing from the bartenders to the coat check girls. The doorstaff are very helpful and communicative, I get the feeling that they all have been doing this for a very long time. Luckily for clubs on Granville street that Celebrities rarely plays TOP 40 music on Friday or Saturday otherwise the other big clubs in the city would be suffering. Celebrities night club is by far the best nightclub in the city.


Some important tidbits:

For Tuesday night arrive early, I arrived here at 8 and there was already a huge line. Summer is coming up and I get the feeling this club will only get busier.",2013-04-30T00:12:56Z,124
283,Celebrities Nightclub,2.8,"I used to prefer Celebrities when it was truer to its gaybar roots. I've since had off times when the crowd seemed almost homophobic. I even had one girl say something snotty and homophobic to her friend when I complimented her earrings. Like she thought I was trying to pick her up! Weird!

Anyway, now I only ever go to nights there organised by Restricted Entertainment and this Sunday they put on a Halloween party there. I will say that the staff are always great there! Also bar pour drinks are $6.50 so not too bad. Shots are kind of pricey though.

The decorations the club put up were insanely good. Way to go!

When I first walked in you could really smell the washrooms - not good. But they were actually alright inside. Often they can get pretty bad by the end of the night but Sunday was fine.

I love the dance area here and have spent many a song dancing on the risers over the years. I will still keep going to Celebrities as long as people I know keep organising super fun times here!",2011-11-02T02:40:25Z,124
284,Celebrities Nightclub,2.8,Aweful.  Too expensive and corrupt bouncers.  This isn't Vegas lol.  It seems there are much better choices in town.  We were excited to go here but so disappointing.,2014-12-28T08:33:43Z,124
285,Celebrities Nightclub,2.8,"Fun dance music. Known as a ""gay"" club I have found that there are actually a lot of straight people that go there. No one is made to feel unwelcome.Drinks around $5.  Don't be surprised if you see men in the womans washroom.",2013-05-29T18:42:52Z,124
286,Celebrities Nightclub,2.8,Don't come here for a show you've paid good money for because they will make you wait more than 1 hour. Won't have to deal with that bs if you go to the commodore or fortune or electric owl. Sorry celebs I'm not coming back.,2015-03-26T07:17:09Z,124
287,Celebrities Nightclub,2.8,"Was here on an off night (Weds) but the night before the line went down the whole block. It was ""straight"" night and so all the 19+ year olds were out excited to go dancing. Cover on Tues was a ridiculous $10 and I am sure drinks would have been outrageous had I gone in. But I decided not to wait in line with the annoying valley-ish girls and annoying bros.

So if I had tried on another night I am sure it would have been a lot more fun.

On Weds no one was there, drinks were dirt cheap and the music was good. I would have loved to dance had there been more people. But the space was set up really well, dance floor was cool and the projection system rocked. So that's kinda where my 4 stars come from. I am sure this place gets rocking on the weekend.",2010-01-22T20:25:00Z,124
288,Celebrities Nightclub,2.8,"TOO LOUD! On a scale of 1 - 10 and 10 being the loudest...it's 100 for loudness of music to the piont of hearing damage. Large speakers on dance floor do not help, as well as huge one's on each corner. This place should be given a huge FINE for hearing damage or future damage. One night is all it takes!!!!!  This is a serious review! abnormally loudddddddd",2015-01-14T02:43:24Z,124
289,Celebrities Nightclub,2.8,"I came into Vancouver from downtown Seattle to experience the night life. Reviews on yelp said it was a great club but ... if you don't have a ticket, on the guest list or know the bouncer, then you're out of luck. We waited in line for 1.5 hours, Morgan page was playing and we were right in front of the line at 1am. As we watch people being let in with out a ticket and no stamp on their wrist, we were frustrated and ask how much longer. The bouncer said if you ask one more time, you're not getting in. It's a joke. Don't ever wait in line at this club without being on a guest list, having a ticket or knowing the bouncer personally. They are a joke. We should have went to the other clubs instead, they probably had better service then this ridiculous place. This is a warning for anyone who is hoping to get into this club last minute. I don't usually write a yelp review but I had to.",2018-03-25T09:18:18Z,124
290,Celebrities Nightclub,2.8,"I love this club!

When in Vancouver, and can have a night of dancing and partying, this is the club I always vote for going to. Usually it's with some gay friends, but I've also gone just with the girls and, regardless, always have a BLAST!

Gay clubs are great because everyone is so friendly, the music is always sick (unless it's some lame Top 40 night- don't know if Celebrities has Top 40 nights), you never see any stupid macho BS fights, and girls can dance and not worry about fending off drunk and pushy guys. I have been hit on by girls here and I take it as absolute flattery! Celebs isn't exclusively gay, so there's also the chance of meeting the type of straight guy that I'm into- ones that have no problem/insecurities about gay people, and are more evolved.

The last time I was here, a few weeks ago, my friends and I danced for hours to the most kickin house and dubstep I could hope for.

I will always come back here when I'm up in Vancouver!",2013-01-25T23:51:10Z,124
291,Celebrities Nightclub,2.8,"Who wants to win $100? ME ME ME ME MEEEE!!! As if Bingo isn't fun enough already, now you can play it with a bunch of queens! Hosted by the sassy Joan-E, who keeps everyone in line with her witty jokes and will openly ridicule you if you aren't cheering when she yells O-69, this is the night your grandparents wished they went to instead of those sleazy casinos. 

To play, you need to buy a stack of bingo cards (by donation but suggested amount is $10) and they provide the dab-o-ink's (da-boinks if you read it like I do, aka the bingo ink blotters). The tables are set up on what is usually the dance floor, and they fill up fast so its a good idea to email james@celebritiesnightclub.com before 4pm on Wednesday to reserve a table, (this event is every Wednesday, so you get can your hump day on with some da-boink). All of the donations from the lotto cards go to Friends for Life which is a non-profit organization that offers individual support and counselling, group and social support, body and energy therapies, nutrition programs and in-home support for individuals in the palliative stages of illness. 

Last night, they rasied $900! How cool is that?! You get to have fun with friends (and make new ones, as everyone there is super friendly, and people are more than willing to let you sit at their table if you ask) have a drink (or five, however I noticed its a lot harder to pay attention to Bingo and the numbers being called when you are blasted - not that I was, but there were a few false bingos shouted out cuz people were having a little too much fun) and donate money to a good cause (we're all gonna get old one day no matter how much plastic we get). So why haven't YOU gone to Bingo For Life yet? Still drinkin' that hate-r-raide? Girlfriend you need to trade that shit in and get yo'self a double highball, they are only $8 fiddy on Wednesdays, and if you have enough you may want to stay for the drag show called Dollicious which starts after gay bingo ends. Wednesday is the new Friday bitches!",2012-03-01T19:59:19Z,124
292,Celebrities Nightclub,2.8,"Great Place!! Awesome atmosphere and amazing people!! Celeb Tuesdays are incredibly fun and if you go online and apply your group on the waitlist, you can skip the line! Arrive before the required time though :)",2016-02-27T08:46:38Z,124
293,Celebrities Nightclub,2.8,"Gay & Straight, generally friendly, easy place to have a good time...but for Friday night's $20 cover I don't think I'll become a regular, esp. since the mixed vodka drinks were downright watery.  I'd come back for a real DJ show, cause I'm still a closet raver.",2009-06-09T04:25:17Z,124
294,Celebrities Nightclub,2.8,"If you pay $60 to purchase a ticket in advance, you should not be sent to the back of a mile long line. If I could give it 0 stars, I would.",2018-01-01T17:20:23Z,124
295,Celebrities Nightclub,2.8,"I have this list of clubs where I had the ""Most Unforgettable Party Nights EVER,"" and Celebrities Nightclub has made the cut!!!

Here's why:

Guest DJ: Laidback Luke - DANCE! DANCE! DANCE!
Free entry because of a hook-up (p.s. It was a sold out show!)
Free double shots at the bar from our hook-up! WHOO HOO!! *Gulp
BIG bar with friendly bartendars
Friendly crowd. New friends!!! I love Vancouver residents. =)
1 block away from our hotel
Ins & outs privileges. - I was able to run out and puke and come back in!
Party doesn't stop until 4AM

I had no idea that this was a gay club, and I heard that on some nights, it's not necessarily a gay club. Either way, I couldn't tell and neither could my boyfriend.

I got my dance on. I got my drank on. I got my socializing on. And I wen't back to the hotel without my dancing shoes on! Whoo, what a night!!! =D",2012-01-18T20:38:14Z,124
296,Celebrities Nightclub,2.8,"Very dirty, it's totally filthy. The foyer smells like the bathrooms, the walls are sticky, there's a months worth of chewed gum stuck to the pillar on the dance floor. The music is subjective, sure, but let's just say hardly anyone was dancing. The staff were not welcoming or polite either. And guess what? They charged us $20 each for cover charge! What a rip off. Oh yeah, bathroom stall didn't have a lock so ya gotta hold it closed. Man that place is disgusting.",2012-10-23T22:15:05Z,124
297,Celebrities Nightclub,2.8,LOVE how we can be ourselves and dress as we please and dance they night away to awesome house music...,2015-08-12T00:31:03Z,124
298,Celebrities Nightclub,2.8,"Best club I like to come to just to have a great time, I was just in over the weekend after the pride parade. Obviously this is a one off but when I have come here in the past I always have a blast. Definitely a club like feel, one of the better looking ones in Vancouver. Drinks were quite reasonable, as well a really good crowd. Will continue to keep coming",2015-08-06T21:31:19Z,124
299,Celebrities Nightclub,2.8,"""You know they getting straighter and straighter, younger and dumber let's shut it down.""
Just kidding (except not really). Well, basically i don't even know why this is still on davie when it's pretty much become a straight factory. I admit I've had lots of fun here on pride nights and certain non-event Top 40 Saturday nights, but aside from that meh. Been to 2 hard candy thursdays, huge disappointment; on the second night the music was totally tragic and the go-go dancers were barely on stage. Never been to straight tuesdays and never intended to, but there's always this insanely long line up everytime i passed by. The drinks are also kinda pricey. It's under remodelling or something right now and i'm keeping my fingers crossed it'll go back to its root, but i honestly don't see that happening. We'll see.
Hence, straight men pull urselves together so them girls won't have a reason to hang around there so often anymore. I'll probably still end up here once in a bluemoon, but i won't if i can help it.",2013-02-18T07:14:02Z,124
300,Celebrities Nightclub,2.8,"After my second visit to Celebrities, this time to see house music DJ Deadmau5, I can confirm that I would definitely return here to see more big DJ shows.

Technically, Celebrities is a gay bar but you wouldn't know it unless you took a gander at some of the suggestive posters.  I could care less if the venue I'm going to is gay oriented or not, in fact, sometimes I prefer it because there are way less creepy jerks to harass you.  I am a woman after all and sometimes guys can get drunk and gross, y'know? I'm sure you do.  The venue is quite huge, my favourite spot being the upstairs hallway, just wide enough to dance in and still get some downtime from the madness below.  Drinks are pricey and they never have drink specials during DJ events but that is to be expected from large dance halls.  Expect to see major DJ's stroll through here on a regular basis, I went to see Richie Hawtin a few months ago and unfortunately, he had to cancel the show the day of.  Luckily, Celebrities was able to book him again for a re-show.  Although I wasn't able to see him, we stuck around that first night and had a great time anyway!",2008-11-29T04:53:04Z,124
301,Isabelles,4.3,Spent $19 grand on bottle services and got laid. I'll come to Isabelle's every weekend till I die.,2023-04-22T02:41:03Z,3
302,Isabelles,4.3,Been a few times. The door staff are great. The bartenders unfriendly. The layout of the place is disappointing. There is no dance floor yet the VIP section takes up a lot of room. They need to get rid of the couches near the front as its not that vibe. DJ music is fine.,2022-09-26T08:16:25Z,3
303,Isabelles,4.3,"Chanel was incredible service, helped with using the debt card machine even though I didn't know how to use the machine cause I was from the machine. She gave me an extra shot out of the niceness of her heart. What an amazing person. On top of all of that she was nice to everyone and so gorgeous. Incredible in service. I tipped her as much as I could without losing money to pay my mortgage .",2022-08-28T07:05:56Z,3
304,Aura Nightclub,2.1,"I had a friend who was waiting in line and I had to use the washroom really badly. So I went up to a security guard and gave them my ID and went to the washroom. Long and behold, after I came out of the washroom the security guard who took my ID tried to claim that I was in there for 1.5hrs and tried to charge me a $50 entrance fee to get my ID back when I was only in there for less than 20 mins including wait time for the washroom. I tried to tell him why it took so long but he didn't bother to hear my reasoning. Don't come here if you don't want to get scammed. Not worth it 100%, there are better clubs in Vancouver.",2023-10-29T09:06:09Z,21
305,Aura Nightclub,2.1,"I feel alone sometimes....so alone.

I come for a beverage in a sea full or Asian blackheads...who understand this music?

Loud talk of math and D&D along comes my knight in armour...he says he is a GM they call... Alex?

Who gave this valiant prince a smile, the smile of a vancouver realtor that doesnt do drugs?

I bet he gambles too much....

Love is a 4 letter word.

20 stars",2022-12-23T04:29:05Z,21
306,Aura Nightclub,2.1,"3 star club. They get the atmosphere right and DJs play the hits.

But seriously, GET RID OF THE BOTTLE SERVICE AND MAKE MORE ROOM FOR DANCING. Then you could easily be a 4 star club.",2022-07-30T16:55:03Z,21
307,Aura Nightclub,2.1,"First of all, this is an absolutely beautiful venue. From the cozy dim atmosphere to the pretty and colorful lights set up, this place definitely measures up to be a nice looking club. However, looks does not make up for other things like sucky music and such. 

Came here as the first stop of the night with my friends and we all got in for free. Make sure to sign up on the guestlist on the website (just to be safe) and come here before 11pm for free entry (guys are included!). For a Saturday night, this place seem a bit empty. Usually, empty = more dancing room but the music itself was horrible. There seems to be multiple people in the DJ booth and man...........music transitions were rough and song remixes were a bit whack. There was a mix of hip hop/EDM music but overall, it wasn't too fun to dance to since the moment you get into a song, it would abruptly change to another that had a completely different tempo that just throws you off your groove.

Another downside to this club was the drinks and music level. Ordered a cocktail drink that I ended up not drinking since it was far tooooooooo sweet. As for the music level, speakers are situated everywhere, and it was LOUD. My ears were still ringing after leaving the club, so I highly recommend bringing ear plugs if your hearing is sensitive or you want to preserve some of that hearing when you're old. Plus, the live drums didn't help too much either since I felt like I went deaf when standing close to the live drums + loud music. I will say, having a live drummer there was a nice unique twist and I would have enjoyed it more if the drums didn't overpower some of the good songs. 

In summary, this club was a mehhhh and leaving it early was a good choice. I definitely would swing back here and give it a second chance since I heard Fridays are pretty poppin' here.",2016-07-11T13:47:45Z,21
308,Aura Nightclub,2.1,"Suck place, these boucer like stealing moneyyyy. My friend and i was waiting 2 hours and they didnt let us in",2022-02-20T09:52:57Z,21
