,gym_name,overall_rating,review_text,date,review_count
379,The Red Room,2.7,"Only good thing about this place is the music. I went to the Friday cancun night event. Some of the cons were:
- Even though its empty inside, they make you wait outside for 30+ mins. This is especially annoying when you are trying to get in before 10 without paying cover. 
- The coat check. The ladies behind the counter kept my change as tip without even asking!! Bring exact change. 
- Bathrooms were nasty and looked like they hadn't been cleaned in a while. This was on a Friday night at 10 pm! A girl was passed out in one of the stalls, and the staff had no idea! No one was in charge of monitoring bathrooms.
- Bartenders won't give you tap water for free, unless you buy a drink as well. How ridiculous is that?!",2014-11-23T07:22:04Z,55
380,The Red Room,2.7,"Service: 
This place can be attractive to those who are looking for a latin music experience, but the services and people attending the business are so cheap and unpleasant that it's not worth the trouble. 

People: 
The people at the dance floor are smelly and sweaty, so it stinks. The people themselves were nice, no complaints there, other than their smell.

Installations: 
Washrooms stink and apparently peeing on the floor is acceptable and normal for them. Other than that, it's not a pretty place to look at, but it's ok. 

Music: The music was inconsistent and the DJ had the crowd consistently confused about what to dance. A wide variety can be nice to have, as long as the transitions make sense and keep the flow, which was not the case here. 

Verdict: An unpleasant experience awaits for those who expect a respectable experience. If you want to feel like you are on a third world country where they treat you with no respect and with poor principles, go for it, it has all the package. It also comes with terrible smells and poor DJ mixing.",2014-05-17T11:31:58Z,55
381,The Red Room,2.7,Friday Latin Nights one of the best in the City!! Always a good time,2017-09-08T22:37:00Z,55
382,The Red Room,2.7,"Not even one star. I came here to see one of my favorite artists, and his set was absolutely amazing, but the service at this place was despicable. We waited nearly 2 hours to get into the venue (we had bought tickets online two weeks ahead of time). As we were leaving at the end of the night we asked the bartenders for a glass of water and they refused, multiple times. While we were waiting in line TO GET OUT I asked one of the bouncers why they wouldn't serve me water, and he was clearly drunk, and he told me I could fuck off. I will NEVER return to this bar. I can't believe the shit service we got here... I've never had this happen to me before.",2014-12-14T12:38:09Z,55
383,The Red Room,2.7,"The Red Room is pretty much the only place I go out now in the city, particularly Saturday nights. The crowd is always so chill, the music is awesome, and it's nothing but good vibes. Favourite place in Vancouver to go dance and have fun for sure!",2017-10-17T04:38:14Z,55
384,The Red Room,2.7,"I came here for my birthday last year.  I don't go clubbing very often (only in Mexico and maybe twice during the year with friends for a special occasion). I don't remember if we waited in line (that was a loooooonnngg day) but it was on a Friday and if we would have waited in line, I'm sure I would have remembered complaining. I love latin music. I don't know how to dance so I just shook my butt and had a great time. I came with my boyfriend and one other couple and had a lot of fun.",2014-07-15T23:47:14Z,55
385,The Red Room,2.7,"Tonight our anniversary sin city event was held at this first time location. A pleasantly air conditioned (neither too cold/hot), the open layout and increased seating option was a nice change. Sadly the area used as the dungeon left much to be desired. Otherwise the venue rocked. Thank you",2010-08-02T02:37:42Z,55
386,The Red Room,2.7,"I find its unassuming, dive bar-esque entrance to be quite an interesting feature. The venue is sizeable by Vancouver standards and it's been known to host some of the hotter dance and trance acts as of late. On the night of my of visit, to see Dash Berlin, the place was packed to the gills and people were even pushed up onto the go-go risers flanking the main stage.  The tightness of space lends the venue an intimate feel but makes for getting around extremely difficult - there aren't any passageways effectively cordoned by the security staff for guests to move about. The bar staff is courteous, though the entire set up wouldn't really be considered professional by big city standards. It appears that the city has a very healthy appetite of dance/trance music, something I've very pleased to see. I'd be happy to rock out here again the next time I drop in Vancouver.",2010-10-29T22:53:20Z,55
387,The Red Room,2.7,"Red Room is a great venue. From attending shows as a club-goer, to playing shows there as a DJ, it's always great fun. Friendly, efficient staff, killer subs and always a great vibe. It's a strong player in the electronic community, and has been a Vancouver staple for years!",2014-01-17T22:55:27Z,55
388,The Red Room,2.7,"Poor customer service, hole in the wall kind of place. Charge too much for everything given the quality. Wouldn't go back and and wouldn't recommend it. But it could be worse. Really don't know why you would choose this place over any other options in Vancouver.",2016-12-10T07:29:04Z,55
389,The Red Room,2.7,"I love this venue! My guess is that it holds 500 people max, so it's really small and intimate. The dance floor is tiny, which I love. I've only been to live shows here (specifically the Peak Performance Project showcases) and absolutely love it. Drink prices are on par with other places, but the last time I went they had different cups and my highballs were significantly smaller for the same price! So that was disappointing (or, rather, annoying) but not enough to knock them down a star. 

They have a coat check at the back that's pretty cheap ($2 for a jacket and $3 for a purse), the bouncers and other staff have always been super cool and nice... the bathrooms were pretty stinky the last time I was there but I think that was from one specific person and not their general state.

Definitely check it out there if you have the chance! I haven't been to the Latin nights or anything like that so I can't comment on those, but it's a perfect venue for live music.  :D",2011-10-01T22:24:23Z,55
390,The Red Room,2.7,"Have been going to Red Room Fridays (Cancun Nights) regularly since 2011. Cancun Nights are the best when DJ Casanova is playing, when DJ rumpus is playing its meh?. There are a couple of joy killers at the door, but once you get past that point, you'll have a good time",2016-03-05T19:16:49Z,55
391,The Red Room,2.7,"I went to the Red Room on Saturday 14th Jan to see the Stanton Warriors. My ticket said the show started at 9:30 so my friends and I got there around 9:50. When we arrived there was a long line-up which I assumed was for non-ticket holders. When I spoke to the bouncers he told me everyone in the line had tickets. When I asked him why the long line up he said there was a ""process"" everyone had to go through to be allowed in. Everyone had to be ID checked, patted down and ticket checked. Fair enough I thought. Two and quarter hours later we finally got to the front of the queue. When we did eventually under go ""the process"" it took about 30 seconds. In no way does this excuse the fact that we were made to wait in the snow outside all that time. I've been to plenty of clubs and concerts these last 20 years but never have I been made to wait outside for so long when I already had a ticket. I completely fail to understand why they did this. The bouncers seemed to be enjoying themselves with the line-up, something I'm sure they do on non-ticketed nights but on a concert night where everyone has pre-paid it makes no sense does it? Surely that's just 2 more hours less when we could have been spending money at the bar? At one point one of the bouncers did walk up and down the line asking anyone with pink tickets to come to the front of the line. We had pre-bought pink tickets instead of internet tickets so I went to the front only to be told by the ridiculous bouncer that he had now decided anyone with pink tickets and a vagina could come straight in so I was forced back in line. 

When we eventually got inside I liked the layout of the club. Drinks as always were expensive but hey, this is Vancouver, North America's most expensive town for drinks so I didn't really pay much attention to that. I did find the washrooms were as typically disgusting as any you find in a nightclub. There was a guy in the washrooms handing out hand towels, something I find you only get in classy hotels or nightclubs. The latter being a pathetically disguised way of watching for people doing drugs in the cubicles. That's as may be but I'd have rather he did something useful like occasionally cleaning the toilets. 

What else can I say? Yeah Stanton Warriors rocked and we had a great time. The sound system whilst very loud (ringing ears the next day) was pretty poor sound quality and was distinctly lacking in bass which is a shame because the Warriors do like to stretch the bass-bins. Finally the visuals that were projected both sides of the stage were incredibly lame and I've seen better from Window's Media Player. In fact one of them was just a powerpoint page advertising the night. 

Overall I'd rate this place zero stars. I will never, ever be going back there again, not even if there's a good gig there; I'll save my money. Finally I suggest you take a look at 4 of the filtered reviews, some of which echo my feedback especially the bit about the needless line-up.",2012-01-23T02:41:26Z,55
392,The Red Room,2.7,A friend and I came here on a weekend trip to Vancouver. We got there at about 10:45pm and there was a line down the block that was not moving. We eventually figured out that if you wanted to get in you had to slip the very rude bouncer $20 to let you skip the line and get in another one to pay the $15 cover. We really wanted to dance some Latin music so we went through the ordeal and did get some good music on their single dance floor but also some very overpriced drinks. According to some locals the lines were not typical but this was the best Latin club in Vancouver so they just put up with it.,2014-08-24T04:06:11Z,55
393,The Red Room,2.7,"Not a fan. Lots of creepers, too many spanish songs with just the odd top 40 song every 10 songs. Good space but not the best crowd, and friends of mine who love it there admit that too. Been once, never again.",2012-11-19T01:11:11Z,55
394,The Red Room,2.7,"Went to Red Room for the first time last Friday. The crowd and music were good however some feedback for management. First I found the ""mandatory"" coat check quite bizarre. What value does this positively bring to the user experience besides the owners fleecing the patrons for that extra $3? If you absolutely must have my $3, then charge me $15 entry fee (instead of $12) and let me keep my jacket if I want to. The other issue was the bar man on the left of the entrance. On entry into the club, I bought a drink from him with no issues. Later that night i walked back to him to get 2 glasses of water (one for me and one for a friend though I believe an ""explanation"" is not relevant) Anyway he refused to give me 2 glasses. He gave me one saying ""I'm only giving you this because you bought a drink from me earlier"" Please tell me this is not the norm and he deviated from his customer service training. We're talking about water! Water!! Must I drink alcohol all night just because I'm in your club? Or maybe customers are expected to drink from the water faucet in the toilet if they get thirsty. Red Room is a good club but its the little things that absolutely ruin the customer experience",2013-03-24T20:41:19Z,55
395,The Red Room,2.7,"it probably would be an okay place and get a better reveiw if the bar tender  there didn't demand to keep your 'ID with your credit card to open a  tab. idendtity theft anyone??

 the night we went the place was a ghost town and my  friend's credit card had a $210 charge  ( they charged $70  three times )for our 2 drinks each. There was no way it was a mix up there were maybe 15 othe people in the whole place...

with staff who steal I won't be going back",2011-06-07T15:41:44Z,55
396,Drais Vancouver,2.8,"So me and a friend went to Drai's two weeks ago and I can't say it was the great club scene you find in Vegas.

We went on a Friday night around 12 pm and there was no line up, which would explain why it wasn't very full when we got in.  Our cover was only $15 which isn't bad.

I can't say I was super impressed. The club is located on the 3rd floor of Trump tower and honestly the lounge downstairs seemed like a better place to hang out.  There is one large bar and a pretty small dance floor. There is of course lots of paid seating upstairs and downstairs.  When we went the upstairs was closed off. The club is nice looking of course, partly because it's new.

We ordered two G&Ts, singles, which came out to $35! Whoah...I'm not in NYC!! I will say,  they were pretty boozy so I guess I could handle the price.  

Is it worth going too? No, but curiosity gets a hold of the best of us. So go check it out.  I'm good and won't be going back anytime soon. I will be checking out that beautiful lounge/bar downstairs.",2017-04-07T02:21:19Z,10
397,Drais Vancouver,2.8,"Brought cover online so we paid in advance and still ended up waiting 2 hours in line only to be so pissed off we left. Apparently, they outsold their venue for the night and there were 3 events going on. The bouncers didn't have a clue what was going on. Honestly, everyone who went in in front of us left after 10mins inside so we asked the girls, who were in front of us and were leaving, how it was inside and they said it was just a bunch of 40 years olds getting drunk and groping young girls. So even though we were in the front of the line we just left cause it isn't worth it.",2018-08-28T03:24:24Z,10
398,Drais Vancouver,2.8,It's a very nicely done.   I appreciated that all drinks were tax and tip included.  Dave was a wonderful host and props to the bouncers whom made me and my friends feel welcome.    Especially Cam.  The music was OK and I enjoyed the light effects here.  I heard there was a pool under the dance floor and am curious if they actually will incorporate that into the club one day.   One thing I like is that you wait in line for the club inside the building instead of outside-which helps especially because it rains so much in Vancouver.,2017-04-07T04:41:04Z,10
399,Drais Vancouver,2.8,"It was my first time at Drais Vancouver, it was awesome. Nothing like the other clubs in the Vancouver! Beautiful layout and astonishing service from everyone that works there! It's not like your typical venue or caprice with your power tripping bouncers and obnoxious service from the bartenders. 

At drai's Vancouver you find guest experience at its finest. They're attitude matches there beautiful lay out. One of our bartenders made me an old fashioned and poured my girlfriend her wine. The total came to 30 dollars. Completely reasonable. Also the tips included! I checked out the table service menu and it's actually a lot better than most clubs in Vancouver, especially with there layout.

Whatever rumour you guys are hearing about this place, most likely isn't true. In any service industry your looking at the service. Our host who gave us a tour had all the experience for making our night a memorable one. A Big shout out to Selina Loum! Thank you for your hospitality and proving the anti-drais wrong.  

I'll defiantly be back!",2017-05-01T00:26:55Z,10
400,Drais Vancouver,2.8,I was visiting my friend who lives in the apartment side and she suggested that we go down to the pool to hang out. Thoroughly anticipating a large pool...surprise! It's inside A club??? It was very tiny...This was during the daytime so there was just a handful of visitors sitting sparingly around the area. We were getting hungry so we decide to order some food as there was food service. Basically it's typical bar food from a small limited menu. We had to repeatedly ask for napkins and cutlery . Interesting they only gave us cloth napkins.... the chicken pieces were pretty moist and tasty but the Caesar salad was very plain and was like the ones you make at home with store bought dressing... no Parmesan even...the shrimp appetizer was very well plated and pleasing to the eye.,2017-08-04T18:03:41Z,10
401,Drais Vancouver,2.8,"Disclaimer- I don't love the Vancouver nightclub scene but I am quite a big fun of rad venues and I'll hit up the pool parties in Vegas so I am not a complete granny. 


I arrived on a Sunday just for 1 cocktail as my friend is a resident at the Trump Tower ( don't hold it against him). This is supposed to be prime pool party time. 

The space is stunning! The screens look incredible. The pool is tiny for a hotel as large as this though. 

We walked in to see about 10 people sitting around VIP tables. I know that this place is hurting because of the Trump backlash. The place was very quiet. 

We walked up to the bar and waited 5 mins for the bartender to say hi.We were the ONLY people there. Asked for a menu and ordered a popsicle in champagne. The bartender looks confused and walks over to who I can assume is the bar manager. He comes up and says ""she is confused about what you ordered."" I point to the item on the menu and he says ""oh yeah we don't have that."" I casually say ""oh that sucks.""..his response was "" it is a popsicle, I think you'll live."" Cool thanks for being super condescending. I order a Moscow Mule instead. At this time the original bartender is crouching in the corner taking a shot ( maybe this is why she was confused about the order?)  We wait about 10 mins for the bartender to craft our cocktails and then he puts them in front of us and we wait another two mins for the bill. Our 1st mission is accomplished; we have acquired a cocktail. I take a sip. It is fine but not the best I've had mostly because I prefer them to be made with crushed iced but it's all good. This is a pool bar not a craft cocktail bar so I am satisfied.

We go and sit outside on the patio and watch the scene. 

2 promo models dancing by the DJ booth. Everyone else is sitting at the VIP tables looking bored and on their phones. 1 table orders a $250 750ml of Grey Goose and two beautiful bathing suit clad servers bring it out carrying a light up magic wand. They stand there and the funniest thing I have ever seen happened. She is holding the bottle up to show the empty bar that these guys bought a bottle and they start dancing but the expression on both of their faces was priceless. Eyes rolling and looking very embarrassed. 

I think this place has great potential but truthfully the service and vibe needs to be cleaned up.",2017-09-06T20:35:49Z,10
402,Drais Vancouver,2.8,"The music was excellent. The service was good. But the club smelled like throw up, even at the beginning of the night. (we were the first large group to arrive). The restrooms were also the dirtiest restrooms I've ever seen-again- it was early and only a few people at the club at this time so it seemed they didn't even clean up from the night before.",2017-08-08T07:39:05Z,10
403,Drais Vancouver,2.8,"TERRIBLE!!! Went there on a Thursday, it was a strange crowd..... Drinks were WAY over priced as in 60$ for 2 vodka sodas (seriously?). And overall not fun! Never going back.",2017-04-16T16:06:34Z,10
404,Drais Vancouver,2.8,"Reserved a table on a Saturday night to celebrate a birthday with a larger group. Initially walking in I was impressed with the Trump hotel and had high hopes for the club. The club layout and atmosphere has great potential but I was disappointed in the cleanliness of the club and odour that I assume was coming from the floor in our section. It could use a good cleaning or renovation. The girl assigned to our table and take care of us would disappear for 45 mins to an hour, which got to be very frustrating considering we had a larger group and ordered 6 or maybe 7 bottles over the course of the evening. Besides the slower service, the music was decent, even for a night that didn't have an artist performing. Bottle costs are slightly higher than other Vancouver clubs so expect to spend more.",2018-08-08T01:42:29Z,10
405,Drais Vancouver,2.8,"Awesome Sunday  pool party, except male bartender complained he was over worked.... well take a day off. They are only open Thur - sun.  Dont bring your personal problems to work. The girls were great and worked harder than you. Couldn't find a lime.... Fail.",2017-06-12T02:05:23Z,10
406,Commodore Ballroom,3.8,"Before the show and even In between sets, giant projector screens came down on either side of the stage, and along with a dozen or so TV played ads! It totally wrecked the vibe.  WTF!? I came here to have a good time and give myself over to some good music not be hounded by advertisements!",2023-12-14T05:57:43Z,98
407,Commodore Ballroom,3.8,"Love the venue and always have- this review is directed at a staff member, and by extension, the management.

A coupe of weeks ago, I went to see the JINJER show and sat at the upstairs bar for a few minutes between sets. While there, I was watching the bartenders work- I was a mixologist for over 20 years before becoming a General Manager in nightclubs, pubs, etc, so I know what I am speaking about. I'm sitting on the side of the bar, enjoying my beverage, when I see the female bartender pick up a rocks glass and DIG IT INTO THE ICE WELL to fill it with ice for a drink, instead of using the ice scoop, as is required by BC health code. Big deal, you might think. Actually, it is, and here's why.

Not using the scoop does several things, all of them bad. First, the bartender's hand will contact the ice; this is cross-contamination, as their hands will have touched everything behind the bar- the cash register, bottles, countertops, their clothing, their face, the cloth used to clean the bar top, dirty glasses, the credit card machine (that customers touch all night) etc etc. Second, the glass itself will have been in contact with other surfaces like the tray or counter it was on, other glasses it is stacked on (placed there with the bartender's hands) again resulting in cross-contamination. But the big issue is that the ice itself will start to collect tiny glass chips from the rim of glasses being used this way- at the end of the night, when you melt down the ice wells to clean them, you will see tiny GLASS SHARDS on the bottom of the well- these come from the lazy habit of digging the glass into the ice instead of using the scoop, the shards chip off the rims of the glasses. This means that you run a very high risk of getting tiny slivers of GLASS in your drink. Pretty sure nobody wants that. A good bartender will actually be FASTER using the scoop if they know whet they are doing (but of course it takes actually paying attention to what you are doing, and learning how to bartend properly), so the only excuse is poor training, supervision and laziness on the part of the management and bartenders. DO NOT order drinks with ice at this venue- stick to wine or beer. Get your shit together Commodore!!",2023-10-18T21:12:55Z,98
408,Commodore Ballroom,3.8,"The iconic Commodore Ballroom is a classic Vancouver giant in the entertainment world. 

Many top artists like - U2, The Police, Tina Turner, Lady Gaga & so many others - have performed here. 

A few shows I've seen here - Sly & Robbie, the Cool Ruler Gregory Isaacs, and now tonight the London soultres Ella Mai! 

Since it was last renovated back in Prince's favourite year - 1999, the CB with capacity at just under 1000, is one of the prime intimate venues dare I say - in the world! 

Surprisingly there isn't a mega gigantic sign on the building highlighting its location on the Granville Mall unlike its sister venues, the Orpheum & Vogue theatres. 

The dance floor here is very spacious is quite an experience if you've ever been on it! When everyones jumping up & down on it - I swear you feel like it's moving & it probably is!!! 

Ella Mai was fresh off her Grammy win on Sunday - massive congrats to her!!! 

To be honest it's rare for me to fork out money to go & see an artist with just a debut album out, but something about her vocals & production has me thinking & feeling she's going to keep climbing high & be around for awhile! 

She could actually be todays new Sade!!! 

I mean why not - she's todays 'empress' & possibly the future of sultry Soul/RnB music. 

Lucky Daye & Kiana Lede were surprisingly very good - vocals & music caught my attention! 

Ella Mai performed songs from her debut album & the backup singers & band performed tightly! 

The sound coming out of the speakers was crisp, clear, heavy, loud & I wanted more!!! 

Very good sound system indeed!!! 

If you can ever attend a live show here at this magnificent venue, please do - you won't regret it!",2019-02-13T11:27:57Z,98
409,Commodore Ballroom,3.8,"So I've been here for a few concerts in the past, but recently I went to a SJS (slow jam sunday) on a long weekend.  

It's not the greatest looking venue, and the bar is old etc but they host some pretty good shows and events.

This particular event was super fun and really packed!
The drink are typical of a club in Vancouver.

What real Vancouverite has not been to the Commodore for something?",2019-12-19T00:08:20Z,98
