,gym_name,overall_rating,review_text,date,review_count
152,Fortune Sound Club,3.5,"I was at a charity fashion show, and was told that they were having an after party with the models at Fortune Night Club.

So to Fortune Night Club I went.  

I had already been drinking at the event, had a decent buzz going, so we came to the club early (the after party started at 10:30, we were there at 9:30).  The security person said that we had to come back at 10:30 or would have to pay cover.

So after wandering around the DTES, being offered drugs loudly by some random dude, and avoiding the the crack addicts losing their shit on the sidwalks, we found an interesting joint to have beers at and chill for the hour.  

At 10:30, we showed up to Fortune and there was a big line, but the security said that since we had the event tickets we could skip the line, and go right in.  Don't get why we couldn't just go in at 9:30, when they had a much larger line at 10:30.    

Also, I ordered a rum and coke, and the bartender thought I ordered 6, and gave me 6 rum and cokes.  I didn't want to get in a piss fest over who said what, so he said he'd charge me doubles (which would be cheaper), and I split the order with a friend I went with.  I wasn't happy about it though, because I ended up having way more rum and coke than I wanted.  The bartenders are way faster, make less mistakes at the clubs on some of the Granville clubs.  

I'd give the overall vibe and venue 4 stars, but wasn't happy about the drink mix-up.  I'd been here once before, a few years ago and it hasn't changed much at all, so what they're doing looks like it's working for them.  It's definitely a unique looking club, something different in the Vancity scene.  And it has an overall very friendly crowd compared to what you usually see in the more typical Vancouver club (there weren't any dudes in muscle shirts spazzing out here or 19 year-old chicks stampeding each other to get to coat check first).  

It's worth a night out at, if you want a look at something different than what you usually get in Vancouver.",2014-05-04T09:34:42Z,97
153,Fortune Sound Club,3.5,"Cool space, three rooms and middle floor project space + hella bars + hosts epic artists + chill quality crowd; different than your basic Granville vibe + sound system is insane + friendly and efficient staff + VIP that isn't stupid + hella bebs. Fortune been holdin it down in Chinatown.",2016-12-21T09:16:44Z,97
154,Fortune Sound Club,3.5,"This place has only been open a few months, I'm told, and it looks amazing. It's smack in the middle of Chinatown, so they've taken a few design cues there, from the mural that runs along the entry staircase (I felt a little like I was going up to Andy's friend's funky apartment in Pretty in Pink) to the big round reddish lights at either end of the room that reminded me of the Japanese flag. 

I was there early in the night for an event, so it was very chill with DJs playing and lots of space to lounge around on the banquettes and chat. Bartenders, coat check staff, and door staff - all very nice and friendly, too. And would you look at the size of that dance floor! I'm going to have to start staying up later. 

PS No beer on draft here, only bottles. But reasonably priced.",2009-11-20T17:54:27Z,97
155,Fortune Sound Club,3.5,"This place looks almost hidden in China town, but its definitely the newest hotspot in Van.
I've been here a couple of times and the bar has a nice atmosphere, good drink specials, and a kickin' sound system.
I will definitely be frequenting this place often and i'm sure you will too!",2010-01-06T18:09:09Z,97
156,Fortune Sound Club,3.5,"Cool crowd and cool staff.  No douche factor.  Rocking sound system.  Unfortunately the location is not near the nicest areas of town.
Haven't been to a non-show night, so I can't speculate on if it's like that every night.",2011-09-28T08:24:33Z,97
157,Fortune Sound Club,3.5,"Since moving to Chinatown I've been hitting up Fortune Sound Club a lot more often, and I always have a bangin' good time. It's not just the close proximity that keeps me coming back, but it's the excellent selection of shows. I've seen a lot of techno (yes, it's still a thing) DJ's that you don't really see many other places in Vancouver, discovered some awesome local bands, been to great artsy fundraisers. All in all, Fortune Sound Club does a really good job of hosting the events that me and mine want to attend.

Honestly, I am not sure of drink prices because I only ever buy beer from the coat check lady's bin - which is about $4, not bad. 

The venue is just the right size to accommodate the shows they put on, not so big that it feels empty, not so small that it gets cramped. There's plenty of room to dance your pants off, and enough seating to rest when you and your dancypants need a break.

I like Fortune, and I'm sure I'll return often for as long as they bring in the awesome shows. Woowoo!",2012-12-21T22:23:25Z,97
158,Fortune Sound Club,3.5,"Best sound system in VanCity with their FunkTion-One.  Best sound experience bar far in Vancouver.  I was the first one in their one night when it was empty and I just wanted to lie down in the middle of the dance floor and pretend it was my living room.  The sound seeps into your pores during the night.

Everyone has a different club experience depending on who they are with and what they like.  I am just describing the killer sound rig and dance experience.  The decor is kind of like a miny Commodore Ballroom.  It is warm and laid back.  Central wood dancing floor with earth tone interior.    You could wear pretty much whatever you liked.  Overabundance of hipsters and oversized Nerd glassess but peeps where chilled without a lot of tude'.  Summer of 2010 seemed to be chicks with skorts.

I like house, Drum and Bass and Dubstep.  Place is packed to the rafters when they bring in a Dubstep name...it is an unreal experience with a Dubstep master on the Funktion-One.  Similar to a modern day Stonehenge with the druids of bass whipping up the Vancity vagrants on the pillar like FunkTion-One speakers.   Literally a transcendant experience.  I have seen dancers praying to the speakers in aural ecstasy.

Only complaint is they seem to let a few underagers in on some nights.  So that is good or bad depending of what side of the gap you are looking at.",2010-08-27T03:48:35Z,97
159,Fortune Sound Club,3.5,"There's always great music and a good time at Fortune. It's so much more relaxed than the Granville clubs. Everyone's casual and friendly and I usually end up talking to some new people. It's a little grubby inside, but that adds to Fortune's carefree feel. 

If you want to dance, try going on a Friday. The DJ's are great and it's not top 40's. It can get really full, so be prepared to bump into a lot of people. But, if you're going on a different night, make sure you check the website first. I went on a Saturday once when they were playing more mellow music that we couldn't dance to. We stayed and listened, but it wasn't what we expected.",2012-11-26T16:48:06Z,97
160,Fortune Sound Club,3.5,"Went for the Chet Faker show on May 23rd.

I remember going here back before it was Fortune... I think it was called the Rainbow Unicorn Club, or something of that nature. 

Now it's 2014 and I'm don't go to shows as much as I used/like to. Call me an old man if you wish, I call myself ""Mr. Fiscal Responsibility."" Luckily I got tickets as a bday present, so time to let loose!

The venue is a nice space. It's long and square with a main and back bar. It's terraced so those choosing not to be in the front row actually have a decent view of the stage. 

As mentioned previously, the sound system is FANTASTIC! It sounds so beautiful and loud, without being too loud. I can see why electronic and hip-hop artists frequent this place, the lows are low and the highs are refreshingly high. As an audiophile, I really appreciate the amount of care that went into it.

Drinks are standard, if not pricey. Two Gin & Tonics were $14.00... Having a few of those set me shrunk my wallet quickly. 

Chet Faker was an early show, and by the end of the set the crowd/audience was quite loud and rowdy. I felt like those who arrive to get their sweat on came around 10p.m. while he was performing... a bit rude but a great show nonetheless.",2014-05-27T17:10:32Z,97
161,Fortune Sound Club,3.5,"This location is great because it's away from the Granville strip and busy parts of downtown Vancouver.  Meaning, it's easier to find parking here (if you're driving).   But if you prefer to be in the downtown core, then maybe it's not ideal.

The people working here from the bouncers, to coat check, to bar staff were all super friendly.  There were no creepy guys trying to grind with you.  Always a plus. The music was danceable and it wasn't your typical hip hop style of music on a Friday night.  

However, I like dancing to hip hop music.  I would have been happier if they had included a little bit of it in to the mix.  (Are there nights they play  mostly hip hop?).  They were a bit slow getting back to me with the guest list so I wasn't aware of what time to arrive until the day of. But by then I wasn't able to notify my friends. 

I was slightly put off by the $15 cover... but is that the going rate these days? I don't even know.  Honey charges $10.  Then they had a mandatory coat check for $3.  So basically, if you brought a coat, the bare minimum it costs to dance here is $18.  That is a little ridiculous.  Drinks were $6.75 for singles, and $8.75 doubles. 

So overall, I thought Fortune was okay.  I found it to be a pretentiously priced, and the music was okay for dancing to, but we didn't have a blast.",2010-06-28T23:28:11Z,97
162,Fortune Sound Club,3.5,"There are few reasons why night crawlers would stand in the cold and migrate towards Chinatown in the evenings ... but it is worth going ""For Tune."" ;)

The music. Always decent - good deep house, dub DJs for special events and old school beats in the back sound room. 

The sound. This is the big home hitter, as I'm sure you've read. You know the sound is good when it fills the whole club and you can still speak to a friend beside you without yelling. 

The crowd. Very chill and random, but with lots of urban hipsters sportin' the skinnies and funky glasses. It's also become younger since it opened. 

What's more:
- Great review on here by Johnson C.
- It would be awesome if Fortune brought in some international house or more deep house DJs (like Morgan Page, Glenn Morrison, Marques Wyatt). It's such a great venue for performances!",2011-10-02T03:36:06Z,97
163,Fortune Sound Club,3.5,"First time going clubbing, worse experience ever. I was told the max price for cover would be $18, but when I went up to the cashier to pay it somehow raised up to $25. Since I was already there, I decided to just go in and try it out. I HATED the music! ALL THE GOOD SONGS WERE CUT SHORT and all the songs I didn't know felt like it was going on forever. Long story short, I do not recommend this club.",2018-09-07T07:08:51Z,97
164,Fortune Sound Club,3.5,"Argh...I want to like this place. I do...because clubbing is super subjective, I want to appreciate it for what it is, and not how I feel about it. So, a 3 is being generous, and that's because of the sound system. Quick caveat, I hate hip-hop.

Went to this as an after party after an elite event a few weeks ago. As usual, we were looking for a place to continue the Yelp awesomeness. We went here on the suggestion of a friend that it had great dancing and music. Well, there was definitely enough space to dance. The place is quite large and I didn't have to fight my way through a crowd. Granted, it was a Monday night....but the place IS big. As everybody else has mentioned, the sound system is great. Probably can't be beat.

My biggest problem however is the cash bar. I mean, come on. That's ridiculous in this era, when most people carry around their debit cards. In fact, I can count on one hand the amount of times I actually carry cash, and that's usually only for emergencies. Besides, it's in their best interest to allow tabs/credit cards because then I'll drink more!

The other problem was the crowd...I mean, there really wasn't any decent dancing to be had...however, the guys for the most part were respectful enough. No groping, nothing that warranted a kick in certain places.

Best part of the night was one of the chicks that got up on stage for the ""karaoke"" portion. She was amazing...wish I knew who she was, or could remember what she sang...

Anyway, if you're into hip-hop, this is probably the best that you can do. If you're looking to dance to some decent music, this isn't the place.",2012-07-28T11:14:26Z,97
165,Fortune Sound Club,3.5,"My favorite place to turn-up in the city... Parties are dope, music is always on-point af, the ppl are always fun, and it's just a liiiiiiittle bit gutter (which i like).",2016-01-23T00:25:53Z,97
166,Fortune Sound Club,3.5,"I've been here twice now on a Friday night, and while I agree that the sound system is amazing, I thought the music was just ""OK"" and not as danceable as at other clubs. But they probably have a very different selection of music on different nights...
The not-so-great features of Fortune are the pricey drinks, pricey cover even if you're on the guest list (this gets a mixed review because both times I was on the guest list; I had to pay cover the first time but not the second) and slightly sketchy location (off the Granville strip, yes, but not the ideal spot if you're taking public transit etc. alone at night as a single female).
The great features of fortune are the atmosphere, the relative lack of sketchy characters invading your personal space and the friendly bartending /bouncer staff. Fun times!",2010-09-04T16:25:59Z,97
167,Fortune Sound Club,3.5,"This venue is in a kind of crazy area, but when you get inside its filled with great people and even better music. Not to mention one of my favourite Vancouver musicians, Chin Injeti always plays there and all the best dancers in the city tend to party here so it's great for watching amazing moves. Stoked for Chin's CD release party here on the 6th! WOOHOO it's going to be killer.

I really recommend this Vancouver hot spot!",2010-03-18T00:48:21Z,97
168,Fortune Sound Club,3.5,"Every time at Fortune is a ball. Don't ever bother going near the Granville strip. Their sound system is nuts, they get some really great shows & events going. What else can you say other than you're gonna have fun!!",2015-10-05T08:01:27Z,97
169,Fortune Sound Club,3.5,"My friends drink was roofied at Fortune last night by the bartenders friend. I ran to the female bartender to ask for water for my friend who has just been drugged and she told me ""it's better if u don't demand it"". god forbid I was trying to save my friend. horrible place. horrible people. even the lady taking out cover was rude as heck. don't go.",2018-04-01T22:07:00Z,97
170,Fortune Sound Club,3.5,"Not your typical Vancouver club experience! Fortune is a club on the third story of a historic building in Chinatown. 

The club layout is nice and the sound is great. The Funktion One speakers stand out from the rest and are the focal point of the room framing the stage.

 Their beer selection is impressive (Parallel 49 Lager, Gypsy Tears, Four Winds IPA, Bomber IPA, Bomber Pilsner, Heineken, Redstipe, Red Truck Lager, Sol, Canadian, MGD, Coors Light, Coors Banquet, PBR, Cariboo). It was nice to have many options in terms of price and selection. 

I have been to some other Clubs in Vancouver who have Grey Goose in their well and charge $13 dollars an ounce.....

The shows are popping and the atmosphere was great the last few times I visited. Overall a nice change from the Typical local club scene.",2016-03-18T06:07:32Z,97
171,Fortune Sound Club,3.5,Went there for god knows why. Saw a band there and it was way better than the other lame show places. The vibe was just chill. Perfect place for very fashionable people to hang out.. Not sure if I want it super popular!,2014-09-03T19:59:36Z,97
172,Fortune Sound Club,3.5,This place sucks. POOPDICK. Horrible. If they cancel on a contract that implies bad business skills. Pushovers and not trustworthy. Can't do business with people like this.,2016-02-11T19:15:39Z,97
173,Fortune Sound Club,3.5,"If a Granville Street club procreated with one on East Hastings, Fortune Sound Club would be the resulting bundle of joy.  It's got the hook-up/creep factor only Granville Street can provide and the unpretentious/hippsterly dressed crowd often found slouching against the walls of a dive bar.  In other words, this place is one big contradiction.  BUT, as many would say, that is its selling point.

1. I've only been to Fortune twice and both times I never had to wait in line BUT that also means the club was kinda empty.  I like it that way but many don't so hold tight because literally in the blink of an eye it gets packed - usually after midnight.

2. The atmosphere is very chill and I'm 99.9% sure you can get away wearing a garbage bag because I saw someone wearing sweats and a full-on tracksuit BUT there are people looking to hook up everywhere!  You can feel their eyes scanning the room.  Once my friends and I got there at 10:00pm and everyone was already coupled up - it got pretty messy.  As we danced they would bump into us and sometimes go right between us.  You could only laugh though - a true clubbing experience.

3. Great, a club away from the Granville strip with regular cop-checks included BUT cover and drinks is still relatively expensive.  On Fridays cover is $15 + $3 mandatory coat check. 

4. The music permeates from the walls and the beats are pretty good BUT some are un-danceable and if you're the type to yell ""I LOVE THIS SONG"" then it's safe to say your voice will be in full tact the next day and you'll be disappointed.  The great thing is that the minute you start thinking ""this song is so long"" the DJ switches it.  

I gave this place 3 stars because there is a nice mixture of people, the music is good and the only downsides are the weekend prices and people creeping.",2010-09-13T20:55:47Z,97
174,Fortune Sound Club,3.5,"I have to say the music was good and I can definitely see how going to fortune for a show would be a good experience.  However,  my friends and I didn't go for a show.  First off the atm wasn't working....  At 11pm. Normally I don't mind walking to a bank,  so I could kind of get over that.  

The worst part was the terrible service at the coat check when my friends and I were leaving.  We left around 12, because honestly the old school rap just isn't our thing.  She seemed ridiculously bothered initially that we wanted to leave so early. We had taken pictures on our phones of our tickets in case we were to lose them on the dance floor.  Of course this happened to my one friend.  Apparently the picture wasn't good enough for her,  and she told us to wait until everyone was let in.  We waited for almost a half hour,  with her repeatedly telling us that we had a problem waiting.  It ended up that one of the doormen noticed and came to help my friend get her jacket.  Thankfully he did because I'm pretty sure the woman would have made us wait until the end of the night,  when she would conveniently have a minute.  I'm not normally one to write reviews,  but  I have never been treated so poorly or with so much disrespect.  I sent the club an email voicing my displeasure and received an email back from the same girl,  with the same excuse.  We have a problem waiting and don't understand their protocol. No apology or explanation. Considering I have worked with the public myself for 10 years,  I am at a loss for words.  I feel bad for the 3 people who's coat check tags I saw on the ground while looking for my friend's,  I doubt they ever got their jackets back.",2014-11-17T23:39:14Z,97
175,Fortune Sound Club,3.5,"The treatment I got in this place is the worst I've had in my 7 years living in Canada. I am never coming back and I don't understand how they run their business treating people like that! The staff was so rude!!! My two friends and I were eating downstairs and the waiter told us we could go directly to the club, so we did but we weren't expecting to stay long so we didn't check in our bags and jackets. Then the security guy came and told us super rudely that we needed to check them in, and when I tried to explain to him that we were just waiting to one of my friends that had gone to the washroom to decide if we would stay or leave, and that we would check them in the coat check if we decided to stay, he started yelling at me without letting me speak. When I told him not to yell at me and tried to explain him again that we were just waiting to my friend to decide, he said ""do you even speak English!"" I've lived, worked and studied in Canada for 7 years so yes, I do speak English,  but I have an accent, so I found this question EXTREMELY offensive and inappropriate). With that I didn't want to continue speaking and my friend (who also has an accent) tried to tell him  that that was not right to say and that we were leaving as soon as my other friend came from the bathroom,  and he replied ""I don't care, just get the F*ck out."" I couldn't believe we were being treated like that, we will never come back to this horrible, horrible place!",2018-12-02T01:55:26Z,97
176,Fortune Sound Club,3.5,"There only a few clubs that I am willing to go without a huge twist of the arm.  Fortune is a terrific place with a great vibe, it lacks that pretentious or fake feel, and it's a great venue to hear music or watch performances.  

I've gone to a couple of hip-hop performances and all have been great.  It's not the type of hip hop show that attract the douche gangster wanna-bees but true hip hop loving folks that are keen on some clever rhyming against some sick and smooth beats.

Friday nights are quite different from Saturday nites.  I've only been to the Saturday night once or twice and I found that it was a younger crowd but packed wall-to-wall.  I preferred the smaller room that night because the music was more my thing.  Fridays tend to play more house music, both current and old.  There's two bars, a smaller room, and a private room for events.  

People say that it's not in the greatest part of town but it's not like any other club in Vancouver is in a stellar and clean 'hood.",2012-05-11T06:01:48Z,97
177,Fortune Sound Club,3.5,"Before I say anything, I have to say that the sound system is incredible.  It envelops you in an ocean of rhythm, harmony, and emotion..  It also doesn't leave your ears ringing.  However, asides from that, I was not as impressed with Fortune as many people.  I felt that it was overpriced, and that the music which was being played out of said amazing sound system wasn't that great.  Half the time, I felt like I was standing there going ""How do you dance to that????"".  And is it really worth $15????  I've paid $30 to go to one of the best clubs in Montreal (in one of the hottest location) to see Bob Sinclair.  Or, I've paid $15 to go clubbing on the top floor of the tallest building in the city.  I just wasn't exactly sure what I was paying $15 for. 

Also, is it standard that guest listing only gets you ahead of the line?  Every other time I've guest listed, it's been a no cover deal.   

I also found the location a little sketchy.  As a single woman going to a club and then heading home in a different direction from her friends, Chinatown does not feel like the safest place to be.  I usually walk everywhere, but I hailed a cab this time.   I think I prefer clubs in location with a little more hustle and bustle.  

Overall all though, I did have a great time because I was with some great people!  It's amazing how even when things don't live up to expectations, the friends who you go with can exceed them.",2010-07-10T04:07:17Z,97
178,Fortune Sound Club,3.5,"Great sound system!

Spent NYE here and there was a fun crowd, great bartenders, and my friends loved it!",2013-01-28T00:48:25Z,97
179,Fortune Sound Club,3.5,I use to really love this club. Great space. But the crowd has really gone downhill. Super young and douchey. Lots of gold chains.,2017-08-26T06:17:09Z,97
180,Fortune Sound Club,3.5,"If you like impeccable mash-ups, headlining DJ's, a sound system that makes your  soul shake  and a crowd that will inspire your sense of fashion, Fortune Sound Club is the perfect place to spend your Wed, Fri, or Saturday nights. 

Located in the up and coming district of China Town, this is a great place to get your groove on while avoiding the hustle and bustle of Granville St. Nawmsayin'?",2010-08-31T19:54:35Z,97
181,Fortune Sound Club,3.5,"I organized a bachelor party night here.  Working with the venue was easy and great.  The place has an underground feel to it and it's in Chinatown, but it's also very clean and the people were chill.  It's definitely more of a locals scene.  Music was hip-hop as as other reviewers have stated, the sound system is top notch.  Definitely would be in my rotation if I lived in Vancouver!",2015-06-30T22:55:09Z,97
